cLabel,cDesc,cSize,cGenes,cScorePheno,pValZ,pValZCorr,pValPerm,pValPermCorr
GO:0015908,"fatty acid transport",17,"PPARD, RBP1, GOT2, MFSD2A, FABP5, RBP7, SLC27A2, SLC27A3, FABP7, SLC25A17, CROT, SLC27A6, ACSL4, FABP5P3, FABP6, CRABP1, FABP3",-0.0370564828148764,0.698814408587616,0.999912282895439,0.61786,0.976327815256876
GO:0016241,"regulation of macroautophagy",39,"LAMTOR5, ULK1, PRKAB2, ATG101, ATP6V1B2, VPS35, PRKAB1, UBQLN2, LAMTOR1, RHEB, GBA, ATP6V1C1, RRAGB, CASP3, VPS26B, ATP13A2, UCHL1, RRAGC, CAPN1, CAPNS1, PRKAA2, ATP6V0A1, ATP6V1E1, PRKAG2, SH3GLB1, ATP6V1A, SLC38A9, ATP6V1E2, MLST8, ATP6V0A2, RRAGD, ATP6V0E2, BECN1, ATP6V0D1, CDK5, LAMTOR2, LAMTOR4, ATP6V0C, ATP6V1H",-0.0350973911617296,0.699944008432546,0.999912282895439,0.60172,0.961441194968553
GO:0007416,"synapse assembly",47,"GNPAT, DRD2, SDK1, MAP1B, KIRREL3, MECP2, BDNF, PCDHB14, DNM3, BSN, ADGRL3, NLGN1, RAB29, IGFN1, FLRT3, SPOCK2, SLITRK6, RYK, PLXND1, NRXN2, FARP1, DSCAM, SDK2, DBNL, ADD2, PCDHB2, PCDHB9, SHANK2, NRG1, SLC25A46, SLITRK1, DNER, CDH9, ACHE, PCLO, PCDHB10, CDK5, CDH2, DRD1, PCDHB11, NRXN1, VPS35, CDH1, PCDHB16, GPM6A, SHANK3, NRCAM",-0.0198493730637777,0.700159673037538,0.999912282895439,0.69438,1
GO:0030111,"regulation of Wnt signaling pathway",11,"CMAHP, MDFIC, RSPO3, SENP2, GSKIP, PLPP3, TCF7L1, LEF1, TMEM237, SNX3, CBFB",-0.0512868063316929,0.700703089500705,0.999912282895439,0.64906,0.995108450704225
GO:0098664,"G-protein coupled serotonin receptor signaling pathway",10,"HTR2C, HRH2, CHRM2, HRH3, HTR7, GNAZ, CHRM3, CHRM1, HTR2A, HRH1",-0.0560830944129552,0.701810697642256,0.999912282895439,0.69168,1
GO:0017157,"regulation of exocytosis",22,"RAB10, RAB3B, RIMS2, RAB15, CPLX1, SYT1, STX1B, STX1A, RAB3D, RPH3AL, RAB3C, PCLO, NSF, RAPGEF4, STXBP5L, CPLX2, RALA, RAB13, RAB12, LGI3, STXBP5, RAB8B",-0.0222437830600844,0.702146766648161,0.999912282895439,0.63622,0.986400152749491
GO:0097178,"ruffle assembly",8,"AIF1L, SNX10, DBNL, AIF1, SH3BP1, INPP5K, CSPG4, RAC1",-0.0538019793273718,0.702154336065841,0.999912282895439,0.59426,0.953885977859779
GO:0006090,"pyruvate metabolic process",15,"DLD, SLC16A3, LDHA, ME2, SLC16A8, LDHC, ME1, PDHB, ME3, HAGH, PC, GLO1, PDHA1, PCK2, LDHB",-0.0619879150372929,0.702319595831307,0.999912282895439,0.6048,0.961622442588726
GO:0010811,"positive regulation of cell-substrate adhesion",17,"FBLN2, VWC2, RELL2, NPNT, RSU1, EDIL3, HSD17B12, CCDC80, PDGFB, PTN, FOXF1, RAC1, NPY, JAK2, HACD1, VIT, SPOCK2",-0.0314647882288071,0.702629577740929,0.999912282895439,0.6313,0.983366871165644
GO:0001963,"synaptic transmission, dopaminergic",7,"RASD2, SNCA, DRD1, CRH, CRHBP, CDK5, DRD2",-0.0436170006896366,0.703406722392307,0.999912282895439,0.69736,1
GO:0046710,"GDP metabolic process",6,"GUK1, CASK, DLG2, MPP1, MAGI3, DLG1",-0.0108444714201364,0.70341165000483,0.999912282895439,0.6636,1
GO:0034638,"phosphatidylcholine catabolic process",7,"ENPP2, PLA2G7, LIPC, PLA2G5, PNPLA7, PLA2G4A, PLB1",-0.0202031296129921,0.703650072868388,0.999912282895439,0.63294,0.983819448698315
GO:0071243,"cellular response to arsenic-containing substance",8,"PPIF, UROS, ZFAND2A, DDX3X, HMOX1, CPEB2, MKNK2, GSTO2",-0.0221858333190367,0.703949075359008,0.999912282895439,0.65914,1
GO:0043525,"positive regulation of neuron apoptotic process",28,"BCL2L11, PAK3, TNF, MAP2K4, NQO1, BACE1, ITGA1, PIN1, CDC34, CTNNB1, GRIK2, GRN, PRNP, CASP3, NUPR1, AIFM1, UBE2M, ASCL1, NQO2, CDK5, EPHA7, ATF4, HDAC4, BBC3, JUN, MYB, MAP2K7, CDC42",-0.0222287734634711,0.704338056407974,0.999912282895439,0.65244,0.99732921686747
GO:0005980,"glycogen catabolic process",7,"PYGL, STBD1, PGM2L1, PFKM, AGL, PHKA2, CALM1",-0.0334009047740093,0.704912100847319,0.999912282895439,0.66676,1
GO:1901798,"positive regulation of signal transduction by p53 class mediator",7,"RPS20, RPL37, RPL23, CDKN2A, RPS15, HEXIM1, CHD5",-0.0446287291205003,0.706719654331491,0.999912282895439,0.7113,1
GO:0006469,"negative regulation of protein kinase activity",34,"DVL1, TRIB3, DEPTOR, TRIM27, PPM1E, ITGB1BP1, MLLT1, SNCA, YWHAG, GADD45B, TRIB1, DBNDD1, CAMK2N2, RB1, INPP5K, CDKN2A, PRKAG2, ILK, PYDC1, GNAQ, SPRED1, GSKIP, RGN, PTPRC, THY1, HSPB1, EPHB2, DTNBP1, GSTP1, DNAJA3, AKT1S1, NF2, CAMK2N1, CRIPAK",-0.0328735810903243,0.707433380129841,0.999912282895439,0.62878,0.983366871165644
GO:0003084,"positive regulation of systemic arterial blood pressure",7,"ACE, CAMK2N1, ADORA1, NMU, WNK1, ADRA1A, NR2F2",-0.0231917964854917,0.708234797137832,0.999912282895439,0.6876,1
GO:0097190,"apoptotic signaling pathway",40,"IFI27, TNFSF12, CFLAR, BAK1, ANXA6, PAWR, PPARD, CASP3, P2RX4, LY96, DAP, BBC3, SENP1, MAP3K5, DAPL1, TLR3, DAPK3, CASP8AP2, TNFRSF25, FAS, TYROBP, CD38, PRKCA, DAP3, TICAM1, PTGIS, DIDO1, TLR4, IFI27L2, IFI6, ITGAM, APAF1, CASP10, ST20, IFI27L1, CRADD, ADORA1, NDUFA13, CASP1, TFPT",-0.0228778709465265,0.708305407388058,0.999912282895439,0.66986,1
GO:0007595,"lactation",21,"VEGFA, GOT2, SLC29A2, OXTR, APLN, NEURL1, KALRN, HK2, SLC29A1, ATP7B, APRT, UMPS, SOCS2, NCOR2, CDO1, USF2, ZBTB7B, PPAT, NME1, CCND1, DDR1",-0.012253679879199,0.709027120057227,0.999912282895439,0.67498,1
GO:0080182,"histone H3-K4 trimethylation",6,"CTR9, KMT2A, ARID4A, NFYB, OGT, NFYC",-0.0511103340713433,0.709619295244368,0.999912282895439,0.64968,0.995108450704225
GO:0071773,"cellular response to BMP stimulus",11,"ACVRL1, ACVR2A, SMAD9, ACVR1, VSTM2A, SFRP1, RUNX2, HEYL, SPINT2, BMP6, TMEM100",-0.0424625521006859,0.709744682296376,0.999912282895439,0.66674,1
GO:0010883,"regulation of lipid storage",6,"MEST, FBXW7, SREBF1, CPT1A, ALKBH7, SIRT1",-0.0368888061768261,0.710620803062633,0.999912282895439,0.67172,1
GO:0071223,"cellular response to lipoteichoic acid",6,"TLR2, TLR4, TREM2, DEFB131A, RIPK2, TIRAP",-0.0438852180526338,0.711745297251909,0.999912282895439,0.68876,1
GO:0008285,"negative regulation of cell proliferation",191,"KLF10, SMAD1, CDH13, PTGES, CAMK2N1, KIFAP3, AGTPBP1, NUDT6, CHD5, FRK, P3H2, WDR6, JAK2, DDAH1, FTH1, GLI3, PLPP1, TRIM24, BCL11B, TPTE, ARID2, FABP6, ITGA1, CDKN2A, ABI1, TPBG, RPS6KA2, ACKR3, LYN, CTBP2, COL18A1, TMEM127, RASSF5, NME1, HRAS, ATG101, BTG3, CLMN, SIRT2, GTPBP4, CDKN2C, CELF1, DLG5, MYO16, GABBR1, NCK2, AZGP1, CGREF1, SOX4, ADRA1A, MAP2K1, P3H3, SSTR1, NEURL1, PDCD5, GLMN, STK4, DLEC1, ULK1, ZNF268, GSDME, BECN1, FABP3, SPRY1, TSC1, FBXO2, TLR2, BAK1, RERG, PTGS2, FABP7, S100A11, CDKN2D, NUPR1, HDAC4, CDC6, TOB1, ATF5, MNT, SPEG, CDK6, ADORA1, GGNBP2, MTBP, PEMT, PTPN2, SH2B3, CSF1R, HSPA1A, KLF11, QSOX1, IFNLR1, CTNNB1, SMAD3, LMNA, JUN, PPP2R5C, FKTN, SMYD2, TENM1, BAP1, NF2, MSX1, ATP8A2, PROX1, P3H1, GNRH1, SMAD2, PINX1, PDPN, ITGB1BP1, CYP1B1, TESC, GPER1, INSM1, FEZF2, TMIGD3, RARRES1, ADM, INHBA, NKX3-1, DRD2, TP53I11, FGF2, PBRM1, SLIT3, NMI, SSTR2, ZNF503, CBFA2T3, GPNMB, SCIN, SOD2, LDOC1, PKD2, PDS5B, SFRP1, DLC1, ZBTB16, STRN, ACVRL1, RBBP4, IL1B, C18orf54, CEBPA, DIS3L2, FRZB, CIB1, RFPL1, KLF13, PIM2, AR, RAPGEF2, NUPR2, TIMP2, NACC2, PTPRK, TBRG1, IGFBP6, SMAD6, ADGRG1, DHRS2, CD33, DHCR24, BCHE, OPRM1, DPT, LIF, PTHLH, ING2, SKAP2, DNAJA3, ADAMTS8, SKI, DDX20, CDKN1B, PTH1R, CNOT7, CD200, NDN, PTPRJ, GPLD1, PTPN14, BTG1, ING1, DDR1, SRF, DUSP1, SST, CTBP1, RARB",-0.0181151236975338,0.712758185366132,0.999912282895439,0.67674,1
GO:0045216,"cell-cell junction organization",9,"SDK1, LIMS2, NF2, SMAD3, NLGN4X, PRKCI, CXADR, CCM2, SDK2",-0.0396547007226706,0.713512128587506,0.999912282895439,0.6683,1
GO:0032024,"positive regulation of insulin secretion",27,"TM7SF3, LRRC8A, NNAT, GLUD1, TRPM2, SIRT3, GPER1, PCK2, PFKM, TCF7L2, ISL1, GJA1, SOX4, RBP4, TARDBP, DOC2B, PSMD9, SERP1, JAK2, PFKFB2, MYRIP, TRH, ACSL4, RPH3AL, CD38, MCU, BAD",-0.0314308473005026,0.714153249016202,0.999912282895439,0.69526,1
GO:0045197,"establishment or maintenance of epithelial cell apical/basal polarity",10,"PRKCI, DLG1, LRRC7, PARD3, DLG2, PARD6A, MTCL1, DLG5, PARD3B, ILK",-0.0259528418420555,0.715313046189768,0.999912282895439,0.70286,1
GO:0006954,"inflammatory response",129,"LXN, HMGB1, CHUK, PTGER3, TAC1, CCR1, IL34, CCL2, CERS6, TMIGD3, TLR3, POLB, GGT5, HDAC4, TSPAN2, AIF1, PRKD1, CCR5, TBXA2R, PTGS2, OLR1, CDO1, HYAL3, CEBPB, ADM, CRHBP, RELB, BDKRB2, SPP1, HCK, STAB1, LY86, KLRG1, AIM2, LIAS, CXCR4, MAP2K3, TOLLIP, REL, NFKBIZ, GAL, GPER1, SCN1A, HRH1, MFHAS1, NOS2, FOLR2, TUSC2, THEMIS2, LIPA, KNG1, PTGER4, HAVCR2, RAC1, DHX9, IL1RAP, CHST2, AP3B1, CSF1R, FOS, ECM1, MIF, AFAP1L2, CD44, HDAC9, ANXA1, PLA2G4C, C3, ADORA1, CYP26B1, CAMK1D, RIPK2, RPS6KA4, IL17RA, IL15, ADAM8, HDAC5, PTX3, IKBKB, CRH, IL17D, NFKB1, CAMK4, IL17RE, PIK3CD, TIRAP, CHI3L1, BMP6, FFAR4, SEMA7A, TICAM1, PLP1, TNF, SPHK1, NFATC3, PRDX5, PSTPIP1, CMKLR1, ITGB2, TLR4, NLRP3, PLD3, MAPKAPK2, TNIP1, TPST1, LOXL3, BLNK, CYBB, IL1B, TNFRSF4, FPR1, CX3CR1, GPR68, KIT, SCG2, PXK, LAT, ACKR1, ADGRE5, TLR2, SCN9A, CXCL2, CHST1, MGLL, PYCARD, IRF5, LY96, SMAD1, DHRS7B",-0.0211713325829537,0.71546287073969,0.999912282895439,0.65202,0.99718779507785
GO:2000810,"regulation of bicellular tight junction assembly",6,"PRKCH, SNAI2, CBFB, GJA1, SNAI1, CLDN5",-0.0388924630695445,0.715815583820568,0.999912282895439,0.65624,0.999204347826087
GO:1901385,"regulation of voltage-gated calcium channel activity",7,"CACNB2, HPCA, AHNAK, DMD, CACNB3, CACNB4, CACNB1",-0.0488913291969205,0.716278839218179,0.999912282895439,0.70942,1
GO:0051291,"protein heterooligomerization",7,"PRPH2, TMEM120A, KCNC2, TMEM120B, SYT1, ROM1, CALHM1",-0.036173889748433,0.716901146161903,0.999912282895439,0.64098,0.989748529411765
GO:2001256,"regulation of store-operated calcium entry",9,"HOMER3, HOMER1, SLC8B1, EFHB, STIM1, CD84, JPH4, STC2, CASQ1",-0.0483314491589458,0.717208726540108,0.999912282895439,0.62912,0.983366871165644
GO:0086091,"regulation of heart rate by cardiac conduction",24,"JUP, CTNNA3, CACNA1C, CAMK2D, CACNA1G, DSP, SCN2B, KCNE5, CACNA2D1, CACNB2, HCN4, SCN1B, KCNJ2, KCNJ3, KCNA5, SCN3B, KCNQ1, KCNJ5, KCNE4, KCND3, ISL1, KCNH2, SCN4B, KCNH6",-0.0104634385864881,0.717790911973449,0.999912282895439,0.67068,1
GO:0043031,"negative regulation of macrophage activation",5,"NR1H3, ADGRF5, VSIG4, LRFN5, CD200",-0.0708625116028152,0.718495064319188,0.999912282895439,0.70218,1
GO:0090314,"positive regulation of protein targeting to membrane",20,"MFF, CIB1, ERBB2, ANK3, ITGAM, HPCA, ITGB2, HRAS, KCNB1, FIS1, ITGB1BP1, CACNB3, C2CD5, CEMIP, STOM, MTCL1, PAK1, MIEF1, CDK5, PRNP",-0.0447141703649366,0.718780545521015,0.999912282895439,0.66614,1
GO:0030240,"skeletal muscle thin filament assembly",5,"PROX1, ACTC1, TTN, ACTA1, TCAP",-0.0658639746348342,0.71925694202267,0.999912282895439,0.68014,1
GO:0006825,"copper ion transport",5,"ATOX1, SLC31A2, SLC31A1, COX17, ATP7B",-0.015344941159655,0.719277326292581,0.999912282895439,0.73424,1
GO:0006516,"glycoprotein catabolic process",7,"NGLY1, PPP6R3, FBXO44, NEU4, STT3B, ADAMTS9, FBXO2",-0.0351406752453641,0.720551883833005,0.999912282895439,0.69116,1
GO:0008610,"lipid biosynthetic process",8,"ACSL6, ACSL4, ACSS2, PRKAA2, FDFT1, SC5D, MSMO1, SREBF1",-0.0460420043595194,0.720707898714628,0.999912282895439,0.66668,1
GO:0032436,"positive regulation of proteasomal ubiquitin-dependent protein catabolic process",40,"BBS7, RFPL1, RNF19B, CEBPA, USP5, RNF144B, DDRGK1, IL33, TRIB3, ARIH1, NKD2, DVL1, KEAP1, TRIB1, ARIH2, STUB1, PLK2, CBFA2T3, RNF144A, COP1, DAB2, CLU, HECTD1, RCHY1, CHFR, NUB1, ELOB, SUMO2, HSPA1A, VCP, SIRT2, LRRK2, PRICKLE1, ZFAND2A, GBA, NOP53, GABARAP, DDA1, SH3RF1, SOCS5",-0.0204788133841877,0.72128317464482,0.999912282895439,0.69262,1
GO:0008210,"estrogen metabolic process",6,"PDGFRA, HSD17B10, PLEKHA1, HSD17B4, CYP1B1, HSD17B8",-0.0479402924618006,0.721877009590309,0.999912282895439,0.67494,1
GO:0010165,"response to X-ray",9,"CCND1, XRCC4, THBD, ANXA1, MSH2, CASP3, IKBIP, BLM, ERCC1",-0.0409395151788567,0.721972601961428,0.999912282895439,0.73078,1
GO:0003300,"cardiac muscle hypertrophy",5,"TTN, TCAP, RYR2, TIAM1, HDAC2",-0.0574997670366388,0.723134717081958,0.999912282895439,0.66092,1
GO:0007088,"regulation of mitotic nuclear division",8,"CDC42, CDK13, DAPK3, CAV2, FBXW5, PDXP, PIN1, CCDC8",-0.027287480675168,0.723952734912886,0.999912282895439,0.69476,1
GO:1900034,"regulation of cellular response to heat",33,"BAG3, MAPKAPK2, CRYAB, HSPA8, CAMK2A, DNAJC2, NUP54, AAAS, MLST8, HSPH1, BAG2, CAMK2D, HSPB8, MAPK3, NUP85, HSPA1A, NUP88, NUP35, HSBP1, RAE1, SIRT1, RANBP2, RPA2, NUP205, MAPK1, SEH1L, HSP90AB1, BAG5, NDC1, AKT1S1, CAMK2G, DNAJB1, TPR",-0.0254584780600056,0.724073751604793,0.999912282895439,0.69068,1
GO:0040014,"regulation of multicellular organism growth",11,"TNKS2, IGF1, GHR, GAMT, MFSD2A, SOD1, MBD5, PIK3CA, ZMPSTE24, NPY1R, HTRA2",-0.0507623199670736,0.724363455912851,0.999912282895439,0.70976,1
GO:0048265,"response to pain",6,"TAC1, RELN, CRH, RET, PRKCG, EDNRB",-0.0604518241825837,0.724646231154669,0.999912282895439,0.69266,1
GO:0060315,"negative regulation of ryanodine-sensitive calcium-release channel activity",6,"FKBP1B, GSTM2, CALM3, CALM1, PKD2, CALM2",-0.0602006044402113,0.724739505314676,0.999912282895439,0.65132,0.996617788944724
GO:0001893,"maternal placenta development",6,"NR2F2, STOX2, PRDX3, DAZAP1, PRDM1, LDOC1",-0.0208690705670123,0.725059130918728,0.999912282895439,0.68928,1
GO:0036151,"phosphatidylcholine acyl-chain remodeling",15,"LPCAT4, NR1H3, LPCAT1, PLBD1, PLB1, NR1H2, PLA2G5, MBOAT2, LPCAT3, TMEM86B, PLA2G4C, PLA2G4A, MBOAT7, LPCAT2, DBI",-0.0179083173020067,0.725611651593378,0.999912282895439,0.68438,1
GO:0045454,"cell redox homeostasis",24,"NQO1, SLC2A10, PRDX5, PRDX2, TXN2, DLD, NOS1, KRIT1, TXNRD3, PRDX6, CYBB, TXNRD1, GLRX3, NOS2, TXN, GLRX2, ERP44, TXNRD2, PRDX4, PRDX3, GIT1, PRDX1, HVCN1, NFE2L1",-0.0378897436473123,0.726322842055303,0.999912282895439,0.64728,0.99398377016129
GO:0021983,"pituitary gland development",13,"SOX3, PCSK1, ADCYAP1, SRD5A1, MSX1, GLI1, SIX3, INHBB, ISL1, TBX19, PAX6, NR0B1, CDH1",-0.0495046124222054,0.726943526788635,0.999912282895439,0.70608,1
GO:0032438,"melanosome organization",11,"LYST, GPR143, RAB32, BLOC1S2, SNAPIN, AP1M1, RAB29, DTNBP1, SHROOM2, AP3B1, TYRP1",-0.053524336863808,0.728163324576669,0.999912282895439,0.6574,0.999392411382926
GO:0034198,"cellular response to amino acid starvation",42,"ATP6V0D1, DAP, TFEB, SH3GLB1, SLC38A2, ATP6V1A, ITFG2, SESN1, DAPL1, ATP6V1H, RRAGB, ATP6V1B2, MAP3K5, MIOS, LAMTOR1, ATP6V1E2, SZT2, MAPK1, LAMTOR4, LAMTOR5, FAS, RNF152, BECN1, ATP6V1C1, SEH1L, MLST8, RRAGC, DEPDC5, CASTOR1, ATP6V1E1, MAPK3, ATP6V0C, ATF4, IMPACT, MAP1LC3A, LAMTOR2, ATP6V0E2, SLC38A9, RRAGD, PRKD1, CEBPB, RHEB",-0.0340837366795501,0.728850985387309,0.999912282895439,0.64764,0.99398377016129
GO:0010801,"negative regulation of peptidyl-threonine phosphorylation",9,"CALM2, PPP2R5D, PARD3, CALM1, INPP5K, CADM4, SPRED1, SIRT2, CALM3",-0.0349419651963747,0.73107600558769,0.999912282895439,0.65862,0.999749700897308
GO:0050877,"neurological system process",26,"GABRA2, KCNJ11, CHRNA6, GABRE, WDR19, CHRNB1, GABRD, GABRA5, GABRG1, GABRA1, GLRA3, CHRNA3, GABRB1, GABRB3, GLRA2, GABRB2, GABRA3, WFS1, ADGRV1, GABRA4, GLRB, GABRG2, GABRG3, HTR3B, CHRNA4, CHRNA2",-0.0442551515020487,0.731447893713987,0.999912282895439,0.7126,1
GO:2001028,"positive regulation of endothelial cell chemotaxis",8,"MET, SMOC2, FGF2, HSPB1, TMSB4X, P2RX4, SEMA5A, PRKD1",-0.0326277664867512,0.731905216526731,0.999912282895439,0.70406,1
GO:0045722,"positive regulation of gluconeogenesis",9,"DDB1, PTPN2, ARPP19, SIRT1, PPARGC1A, WDR5, FOXO1, DGAT2, NNMT",-0.0169422960482303,0.734195886880855,0.999912282895439,0.72936,1
GO:0019076,"viral release from host cell",8,"DDB1, VPS37B, CAV2, ZNF502, VAPA, TRIM62, CHMP2A, PC",-0.0336208426574343,0.734323285238701,0.999912282895439,0.7258,1
GO:0032722,"positive regulation of chemokine production",22,"DEFB131A, RIPK2, TICAM1, ADORA2B, HMOX1, TLR2, CSF1R, AIRE, IL4R, PYCARD, CARD9, EGR1, IL33, TLR4, LPL, CD74, WNT5A, IL6R, HAVCR2, AIF1, TNF, TLR3",-0.0312408905456477,0.735110690970861,0.999912282895439,0.66394,1
GO:0045184,"establishment of protein localization",18,"ITGA2, WDPCP, CHMP2A, PLEKHA1, ANK3, VCP, DERL1, CHMP1B, NPNT, RIPOR2, NLGN1, PHLDB2, NRXN1, DLG4, ITGA8, ADGRV1, RCC2, WBP2",-0.0343294089423339,0.735127517881485,0.999912282895439,0.698,1
GO:0007084,"mitotic nuclear envelope reassembly",16,"PPP2R2A, UBE2I, NUP205, NUP35, SEH1L, CHMP4B, LMNA, REEP3, CHMP4A, CHMP2A, CCNB1, RAN, SIRT2, NUP85, ANKLE2, NDC1",-0.0346166419504522,0.735222954357877,0.999912282895439,0.686,1
GO:0000462,"maturation of SSU-rRNA from tricistronic rRNA transcript (SSU-rRNA, 5.8S rRNA, LSU-rRNA)",9,"RPS14, MRPS11, ERCC2, GTF2H5, RPS19, BYSL, HELB, BMS1, TSR2",-0.0407568130895712,0.735224357977589,0.999912282895439,0.67948,1
GO:0030073,"insulin secretion",18,"CPLX3, RIMS2, CAMK2G, PCLO, SMAD2, FKBP1B, ACVR2B, NEUROD1, STXBP3, GAL, ILDR2, ANXA1, CYB5R4, STX1A, CPLX1, VGF, ADCYAP1, RAPGEF4",-0.0385975973480796,0.735276952065517,0.999912282895439,0.692,1
GO:0042448,"progesterone metabolic process",6,"SRD5A1, AKR1C1, CYP46A1, AKR1C4, DHRS9, AKR1C3",-0.0848478954053218,0.736221187740576,0.999912282895439,0.71372,1
GO:0060100,"positive regulation of phagocytosis, engulfment",6,"TREM2, PLCG2, PPARG, ITGA2, RAB31, C3",-0.0709190642163275,0.736291431316583,0.999912282895439,0.6459,0.99398377016129
GO:1904871,"positive regulation of protein localization to Cajal body",5,"CCT6A, CCT7, CCT5, MEPCE, TCP1",-0.0534444695670452,0.73659197669497,0.999912282895439,0.7043,1
GO:0000463,"maturation of LSU-rRNA from tricistronic rRNA transcript (SSU-rRNA, 5.8S rRNA, LSU-rRNA)",5,"RPF2, GTPBP4, RPL7, ZNHIT6, RPL35",-0.0587045463206999,0.736865169166751,0.999912282895439,0.7027,1
GO:0006361,"transcription initiation from RNA polymerase I promoter",13,"ERCC2, POLR2E, MAPK3, POLR2L, GTF2H5, POLR2H, POLR1B, POLR2K, TAF1D, TAF1A, CCNH, TAF1C, CAVIN1",-0.0417765095719425,0.737004209656704,0.999912282895439,0.69002,1
GO:0060396,"growth hormone receptor signaling pathway",5,"JAK2, GHR, PIK3R1, PXN, SOCS2",-0.06073256310291,0.737447060259924,0.999912282895439,0.72372,1
GO:0007193,"adenylate cyclase-inhibiting G-protein coupled receptor signaling pathway",36,"CORT, AKAP12, MARCO, NPY1R, EDN1, ADCY2, GRM7, SSTR2, HTR1F, ADCY9, ADORA1, PDE2A, GNAI2, HTR1E, AKAP5, EDNRA, GPR176, OPRK1, MCHR1, ADCY4, P2RY12, GRM8, ADCY7, NPR3, S1PR1, ADCY3, PALM, ADCY8, GABBR1, ADRA2A, GNAZ, RIC8A, RGS1, GNAL, ADCY1, OPRL1",-0.0347685953534411,0.738337601787422,0.999912282895439,0.68944,1
GO:1900006,"positive regulation of dendrite development",8,"LRP8, ELAVL4, CYFIP1, ALK, VLDLR, PTN, PACSIN1, IQGAP1",-0.0256639322960752,0.739341165273887,0.999912282895439,0.70706,1
GO:0010942,"positive regulation of cell death",15,"KCNK2, ACOX2, DNMT3A, DUSP6, SLFN11, SAP30BP, CDKN1B, RAMP3, CRH, TRIM13, MT3, NKX3-1, AKR1C3, RIPK2, CELF1",-0.0188041125544732,0.739762825235557,0.999912282895439,0.72266,1
GO:0042755,"eating behavior",13,"ATP8A2, OPRK1, TRH, OPRM1, OXTR, CCK, UCHL1, NPY5R, OPRL1, CPT1A, BBIP1, ACE, NMU",-0.0662075894863987,0.739999116325344,0.999912282895439,0.68766,1
GO:0036444,"mitochondrial calcium uptake",6,"MCU, MICU2, SLC25A23, MCUB, MCUR1, MICU3",-0.0323048348539559,0.740806522833142,0.999912282895439,0.70758,1
GO:0033209,"tumor necrosis factor-mediated signaling pathway",57,"PSME2, ILK, PSMB5, PSMA5, PSMD12, TRADD, PSMC2, PSME3, CDIP1, PSMB1, LTB, ACTN4, EDARADD, TNFRSF12A, PSMD6, PSMC3, TRAF5, TNFRSF14, PSMD9, TNFSF13B, PSMD4, CARD14, FAS, TNFRSF4, TNF, PSMB8, CHUK, PSMD1, PSMB6, AIM2, KRT18, TMSB4X, TNFSF12, PSMD2, TNFRSF11A, TNFRSF25, NFKBIA, PSMB7, KRT8, PSMA7, MAP3K14, PYCARD, PSMD8, IKBKB, TXNDC17, PSMB2, STAT1, SEM1, JAK2, PSME1, TRAF3, PSMA6, PSMD7, PYDC1, BIRC3, PSMB10, PSMC1",-0.0336001299968101,0.741220604468454,0.999912282895439,0.65822,0.999640847880299
GO:0060079,"excitatory postsynaptic potential",32,"DGKI, RAB3GAP1, CHRNA6, MPP2, P2RX6, MECP2, NPFF, CDK5, PPP1R9A, ADORA1, GRIK2, OPRM1, CHRNB1, DRD2, GLRA2, SEZ6, PPP3CA, GRIN2C, P2RX4, GLRA3, SNCA, SLC29A1, CHRNA4, GLRB, LRRK2, GRID2, GRIN2A, CHRNA3, MEF2C, GRIN2B, CHRNA2, P2RX5",-0.0318492467033904,0.741341068568588,0.999912282895439,0.71866,1
GO:0001780,"neutrophil homeostasis",5,"PDE4B, SH2B3, MTHFD1, MPL, ANXA1",-0.0680670276893048,0.743307134855511,0.999912282895439,0.7168,1
GO:0006108,"malate metabolic process",6,"ME2, MDH2, MDH1, ME3, FH, ME1",-0.0678920213236563,0.743624738500611,0.999912282895439,0.67794,1
GO:0002474,"antigen processing and presentation of peptide antigen via MHC class I",19,"TAP1, SAR1B, CANX, ACE, HLA-F, PDIA3, BCAP31, HLA-H, HLA-G, TAP2, SEC23A, SEC24B, HLA-C, SEC31A, CALR, MR1, SEC24D, HLA-B, B2M",-0.0298881702982183,0.743700865949284,0.999912282895439,0.72998,1
GO:0071679,"commissural neuron axon guidance",10,"NFIB, VEGFA, SMO, ROBO3, RYK, PTCH1, NRP1, EPHB2, NCAM1, FZD3",-0.051311156397202,0.743720066671666,0.999912282895439,0.71902,1
GO:0010828,"positive regulation of glucose transport",5,"C3, CLIP3, NR4A3, C2CD5, BRAF",-0.0335467337241931,0.743989916850153,0.999912282895439,0.72352,1
GO:0006636,"unsaturated fatty acid biosynthetic process",7,"FADS3, DEGS1, FADS2, ELOVL7, ELOVL4, ELOVL1, FADS1",-0.0310979849674411,0.744660866872603,0.999912282895439,0.70402,1
GO:0007009,"plasma membrane organization",10,"BAIAP2L2, MTSS1, FER1L4, MYOF, ANK3, TLCD2, OTOF, OSBPL2, SERP1, BAIAP2",-0.0532706600160301,0.744749977597745,0.999912282895439,0.69328,1
GO:0016055,"Wnt signaling pathway",101,"CCND1, GPC4, DAB2, VPS35, DKK3, ZNRF3, BTRC, SOX17, LEF1, RNF43, NKD2, VPS29, TNKS, WNT4, CD24, ZRANB1, DRD2, MACF1, TLE1, MARK1, FZD2, CALCOCO1, RSPO4, WNT2B, TNIK, PLCG2, DACT1, WNT5A, BCL7B, WLS, PKD1, RSPO3, WNT6, TLE4, WWOX, LDB1, CPE, KREMEN2, WNT10B, SNX3, CDK14, FERMT2, TMEM88, DACT3, SFRP1, RNF138, TLE2, DRAXIN, FZD4, CTNNBIP1, DVL1, TRABD2A, DDB1, DVL2, RPS27A, GID8, CUL3, ADGRA2, NDP, SOSTDC1, UBA52, APCDD1, GRK6, SPIN1, KREMEN1, LGR6, RSPO2, HBP1, PRKAA2, CTNNB1, GRK5, LRRFIP2, AMER1, PKD2, CTNND2, SENP2, WNT7A, EPM2A, ZBTB33, AMOTL1, STRN, TCF7L2, NKD1, CXXC4, HHEX, DDX3X, WNT3, WNT7B, FRZB, WIF1, RYK, CTR9, CCNE1, TNKS2, KLHL12, WNT10A, CCNY, NXN, SKP1, LEO1, TMEM170B",-0.0193167244076818,0.745082194535054,0.999912282895439,0.70684,1
GO:0031146,"SCF-dependent proteasomal ubiquitin-dependent protein catabolic process",45,"PSMD6, PSMA5, PSMD7, PSMA6, FBXL2, FBXL15, FBXL18, PSMB8, PSMB10, PSME3, FBXL3, FBXO33, FBXL4, PSMD4, PSMD12, FBXL16, PSMB5, PSMD2, BTRC, CUL2, PSMC1, PSMB6, PSMA7, PSMB7, CUL4B, FBXW5, FBXO9, PSMD1, PSME2, PSMC2, SEM1, PSMB1, PSMC3, PSMD9, FBXL12, PSME1, FBXO31, CUL4A, PSMB2, SKP1, FBXO44, FBXW7, PSMD8, FBXO2, AMN1",-0.0547122202707449,0.74638750049298,0.999912282895439,0.66924,1
GO:0071364,"cellular response to epidermal growth factor stimulus",20,"DAB2, MCM7, PPP1R9B, SNAI2, ERRFI1, ZFP36L1, BECN1, MYC, PTPN12, FOXC1, DUSP3, BAIAP2, SYAP1, INPP5K, GSTP1, ERBB2, CFLAR, IQGAP1, DUSP22, ZFP36L2",-0.0297007705835638,0.746965766851858,0.999912282895439,0.67648,1
GO:0006349,"regulation of gene expression by genetic imprinting",9,"PRMT7, BRCA1, DIRAS3, MECP2, KDM1B, KCNQ1, ARID4B, DNMT3A, ARID4A",-0.0424837727193748,0.74721833100542,0.999912282895439,0.71778,1
GO:0070328,"triglyceride homeostasis",10,"RORA, ADORA1, NR1H3, HMGCR, ANGPTL4, MED13, LIPC, LPL, GPIHBP1, APOE",-0.0224638220011896,0.747473787650691,0.999912282895439,0.7106,1
GO:0008631,"intrinsic apoptotic signaling pathway in response to oxidative stress",10,"STK24, JAK2, PRKCD, ZNF622, DIABLO, SOD2, MAP3K5, GSKIP, BCL2, CYP1B1",-0.0322672311109978,0.747645272792544,0.999912282895439,0.73266,1
GO:0007589,"body fluid secretion",5,"EDN1, ANXA2, SLC22A4, GUCA1B, VIP",-0.0669634801600748,0.748084631301527,0.999912282895439,0.7105,1
GO:0008306,"associative learning",19,"DRD2, SNAP25, BRSK1, GABRA5, ELAVL4, CLN3, TSC1, TAC1, PGRMC1, SHANK1, NRGN, NPTX2, MAP1A, RELN, CRH, SRF, SHANK2, ASIC1, NEUROD2",-0.0320893176357874,0.749118473107401,0.999912282895439,0.69888,1
GO:1904706,"negative regulation of vascular smooth muscle cell proliferation",15,"MEF2C, S1PR2, GNA12, PRKG1, EFEMP2, CNN1, GSTP1, CDKN1B, SOD2, PDCD4, APLN, TPM1, PPARG, HMOX1, GPER1",-0.0445988524832122,0.749514757148686,0.999912282895439,0.70908,1
GO:0006891,"intra-Golgi vesicle-mediated transport",16,"NAPA, RAB33B, VTI1B, GABARAPL2, COG5, COPZ1, COG3, COG1, NAPG, COG2, CUX1, COPA, COPZ2, RAB6B, NSF, COG6",-0.022714813463433,0.749613101412094,0.999912282895439,0.71346,1
GO:0048148,"behavioral response to cocaine",10,"SNCA, HOMER1, PPP1R1B, DRD1, HTR2A, EHMT2, DRD2, OPRK1, CDK5, SDK1",-0.0527613472531849,0.75059674884436,0.999912282895439,0.74742,1
GO:0071157,"negative regulation of cell cycle arrest",12,"GPER1, NUPR2, HSP90AB1, FZD9, CCND1, EVI2B, CALR, RPL23, MIF, SETMAR, ZNF268, CDK9",-0.0490077807531095,0.75082049188828,0.999912282895439,0.71366,1
GO:0006783,"heme biosynthetic process",13,"TSPO, ALAS1, ABCG2, FLVCR1, SRRD, FXN, TMEM14C, ATP5IF1, UROS, PGRMC1, HMBS, ALB, NFE2L1",-0.0407882570294243,0.751312415926773,0.999912282895439,0.68284,1
GO:0021954,"central nervous system neuron development",9,"AGTPBP1, ASCL1, NTRK2, NPY, CDK5, GBA2, MAP2, GABRB1, NOVA2",-0.0688511161461232,0.75187989345118,0.999912282895439,0.6938,1
GO:0044597,"daunorubicin metabolic process",5,"AKR1B1, AKR1C3, AKR1C4, AKR1C1, AKR7A2",-0.100748952043929,0.752313914373477,0.999912282895439,0.74656,1
GO:0000724,"double-strand break repair via homologous recombination",36,"RNF138, SMC6, MORF4L1, RECQL4, MCM8, NSMCE1, AUNIP, PARP1, SLX4, GEN1, ZSWIM7, WDR48, EXD2, HELQ, RPA2, SEM1, RBBP8, SWI5, RAD51C, AP5S1, BRCA1, SPIDR, RECQL, ERCC4, SWSAP1, RAD52, SMC5, REV3L, RMI1, RMI2, BLM, ZFYVE26, RAD54B, NABP1, INIP, RAD51D",-0.0290028714483966,0.752831775491467,0.999912282895439,0.7393,1
GO:0006635,"fatty acid beta-oxidation",23,"BDH2, CPT1C, ECHS1, ACAT2, HADH, ACADL, ABCD4, HSD17B4, ACOX2, CPT1A, AUH, ABCD2, SLC27A2, SLC25A17, ECI2, MECR, ECH1, ECHDC2, ACAA1, PPARD, CROT, HSD17B10, ACAA2",-0.0500537739341993,0.752973131127336,0.999912282895439,0.70406,1
