cLabel,cDesc,cSize,cGenes,cScorePheno,pValZ,pValZCorr,pValPerm,pValPermCorr
GO:0007250,"activation of NF-kappaB-inducing kinase activity",7,"TLR3, CHI3L1, IRAK1, ZFP91, CARD14, TIRAP, TNFRSF10B",0.139540485354208,0.0290424631937031,0.117755393375267,0.01192,0.0496530779753762
GO:0001508,"action potential",11,"KCNMB2, KCNMB4, GNAQ, GNA15, AKAP6, KCNC2, CLN3, KCNB1, GNA14, CHRNA4, AKAP7",0.231823642652292,0.0291536991297489,0.118049220545326,0.0186,0.0717832699619772
GO:1902667,"regulation of axon guidance",5,"ZSWIM5, NOVA2, ZSWIM4, TBR1, FEZF2",0.124589388819479,0.0299926266148889,0.121255619853922,0.00402,0.0201
GO:0048675,"axon extension",23,"HSP90AB1, USP9X, LHX2, NDN, DCLK1, SEMA5A, SLC9A6, EDNRA, PPP3CB, SEMA7A, C9orf72, MAP1B, VCL, ITGB1, ULK2, DVL1, EDN3, ULK1, EDN1, CYFIP1, CDK5, RAPH1, SEMA5B",0.0501651039586795,0.0300252011066855,0.121255619853922,0.0282,0.102225
GO:0043280,"positive regulation of cysteine-type endopeptidase activity involved in apoptotic process",28,"TNF, PDCD5, CYCS, ARRB1, SIRT1, CASP1, GPER1, FIS1, PMAIP1, NLRP3, FOXL2, CTSD, SYK, BCL10, MAP3K5, NKX3-1, BCL2L11, HMGB1, MYC, NDUFA13, BAD, HTRA2, DDX3X, PYCARD, BCAP31, GRAMD4, CARD9, ACVR1C",0.0687311255088353,0.0302439367325223,0.121977201788782,0.02836,0.10256080760095
GO:0042985,"negative regulation of amyloid precursor protein biosynthetic process",6,"ITM2B, BACE2, ABCA7, AATF, ITM2A, ITM2C",0.145022456159885,0.0304173429599118,0.122514298032978,0.00596,0.0275389984825493
GO:0048681,"negative regulation of axon regeneration",7,"RTN4RL1, INPP5F, RGMA, EPHA4, KREMEN1, PTPRS, RTN4R",0.104453279487262,0.0307078801290204,0.123521129448966,0.00412,0.0204655791190865
GO:0007042,"lysosomal lumen acidification",6,"SNAPIN, CCDC115, TMEM9, CLN3, CLN6, GRN",0.144255516107513,0.030973344643949,0.124381894195966,0.00566,0.0265149230769231
GO:0016540,"protein autoprocessing",11,"F12, CTSL, OMA1, KLK6, PIDD1, PCSK1, SPRTN, FXN, PARP1, HTRA2, CASP1",0.0856177635422887,0.0310035657453985,0.124381894195966,0.01102,0.0463479281767956
GO:0031929,"TOR signaling",6,"LARP1, RHEBL1, RICTOR, MLST8, RPS6KB1, EIF4EBP1",0.0862183520978089,0.0312255111018235,0.124944653165686,0.02668,0.0976449519230769
GO:0050801,"ion homeostasis",9,"CRH, WNK1, SLC4A9, SLC4A3, KLHL3, SLC4A8, SLC4A11, STK39, SLC4A2",0.106781683436842,0.0312259051097167,0.124944653165686,0.03386,0.117972
GO:0015693,"magnesium ion transport",7,"MRS2, NIPAL3, CNNM4, KCNJ2, NIPAL2, TUSC3, NIPA1",0.134808427753889,0.0313714300262857,0.12536221053811,0.01218,0.0506668032786885
GO:0035994,"response to muscle stretch",14,"EDN1, TCAP, JUN, GSN, DMD, SLC8A1, FOS, SLC9A1, PIK3CA, NPPA, NFKBIA, GPI, NFKB1, RYR2",0.0675178527469344,0.0315717053380367,0.125997172679321,0.02944,0.105607764705882
GO:0045190,"isotype switching",6,"ERCC1, RNF168, SWAP70, MSH2, RNF8, ATAD5",0.105879621642775,0.0318255365892827,0.126843925280583,0.01388,0.0567310067114094
GO:0006508,"proteolysis",152,"TLL1, RHBDL3, MST1, C1S, UQCRC2, DPP6, CPVL, AMZ1, ADAMTS4, CASP3, SPCS3, SENP1, PDIA3, PRSS3, LMLN, TRHDE, ADGRG6, HTRA2, MASP2, HPN, ADAM23, ATG4D, PIGK, DPP10, PSMD8, SPRTN, CTSA, PLAU, CFLAR, CTSK, PRSS56, KLK7, MMP15, CAPN15, TPP2, DLD, METAP1, EIF3H, PRSS3P2, PSMB5, ADAMTS19, ENDOU, LRP8, CTSL, LNPEP, PCSK1, GGT5, SFRP1, CNDP1, CTSZ, ADAMTS8, MPND, AGTPBP1, PEPD, FBXL2, CAPNS2, TPP1, CTSH, CASP1, WFDC2, ADAMTS5, TMPRSS5, F12, MMP16, ADAM15, CFD, SPCS1, CLPX, AGBL5, CFAP44, PARL, CTSC, AMZ2, ATG4B, NDEL1, YME1L1, DPP8, PRCP, KLK10, MMP14, CAPN13, NCSTN, ADAM28, ACE, ADAM20, GGTLC1, PRSS2, CAPN12, APEH, SCPEP1, BACE1, QPCT, NLN, PRSS16, ERMP1, SCRN3, PYDC1, NRDC, JMJD7, TBL1X, NUDT16, TFRC, AGA, TRABD2A, UBE3A, DPP7, PM20D2, ACAN, TLL2, YBEY, BACE2, PSMD6, UBA3, FOLH1B, PRSS1, GGH, PLAT, RHBDL2, FBXO2, BLMH, NEDD8, TANK, MASP1, CASP10, NAALAD2, DNPEP, CTSD, VASH1, FAP, KLK5, IDE, CTSO, PAN2, GGT1, PREPL, PREP, VASH2, RHBDF2, NRIP2, PRSS23, CAPN3, ADAMTS13, OLR1, CAPN1, ADAM22, ADAMTS9, SUFU, RELN, HMCES, ZMPSTE24, C2, ADAM8",0.0683579685532936,0.0319588442099341,0.127082079641183,0.0198,0.0757424623115578
GO:2000009,"negative regulation of protein localization to cell surface",6,"GPM6B, LEPROTL1, GOPC, ASTN2, ACTN2, NEDD4L",0.113873407694327,0.0319687596076013,0.127082079641183,0.02232,0.0841143564356436
GO:1903146,"regulation of mitophagy",7,"HTRA2, SREBF1, PINK1, ATP13A2, USP36, PARL, FBXW7",0.190418300234841,0.0321575027454962,0.12766570516302,0.01812,0.0701977099236641
GO:0010717,"regulation of epithelial to mesenchymal transition",5,"EPHA3, TGFBR1, PHLDB2, TIAM1, ELL3",0.126760553615496,0.0322626036534852,0.127916182454248,0.0004,0.00313917525773196
GO:0046324,"regulation of glucose import",8,"ASPSCR1, RTN2, HK2, C1QTNF12, PRKAG2, SLC25A27, RPS6KB1, APPL1",0.100020079197654,0.0323626608390961,0.128134089920748,0.01518,0.0610608982826948
GO:0010508,"positive regulation of autophagy",40,"RNF152, PRKAA2, MID2, TRIM68, BNIP3, TRIM22, PLEKHF1, XBP1, DHRSX, TP53INP2, TRIM27, DEPDC5, TRIM14, SVIP, TICAM1, BAD, FOXO1, LRRK2, SH3GLB1, PIM2, ULK1, TPCN1, ENDOG, MTDH, UFL1, ROCK1, BECN1, ULK2, TRIM32, ATG16L1, PRKD1, PIK3CB, HMGB1, DCN, ATG7, ATF6, TRIM8, OPTN, TFEB, PLK2",0.0522894736437941,0.0324678468519195,0.128134089920748,0.01578,0.0631407358738502
GO:0048842,"positive regulation of axon extension involved in axon guidance",5,"SEMA5A, CXCL12, VEGFA, NRP1, DSCAM",0.204923066686871,0.0324702815406174,0.128134089920748,0.03384,0.117972
GO:0051549,"positive regulation of keratinocyte migration",5,"EPB41L4B, ADAM9, FGF7, IQSEC1, MAPRE2",0.0934062401780543,0.0324858842097921,0.128134089920748,0.00218,0.012224861878453
GO:0051044,"positive regulation of membrane protein ectodomain proteolysis",11,"TNF, SNX9, RGMA, GPLD1, ADAM9, IL1B, APOE, ADAM8, PACSIN3, NRDC, ADRA2A",0.112166395125798,0.0325764892422922,0.12832523899454,0.00598,0.0275895454545455
GO:0046834,"lipid phosphorylation",10,"SPHK2, DGKD, CERK, DGKG, DGKH, DGKB, DGKA, AGK, SPHK1, DGKI",0.0818570566437775,0.0326665841888224,0.128408072855122,0.02834,0.10256080760095
GO:0045723,"positive regulation of fatty acid biosynthetic process",5,"SLC45A3, NR1H3, NR1H2, LPGAT1, RGN",0.165280956982954,0.032701591602881,0.128408072855122,0.00838,0.0370349782293179
GO:0045741,"positive regulation of epidermal growth factor-activated receptor activity",5,"FBXW7, BTC, NEURL1, ADORA1, ADRA2A",0.191775703823567,0.0327240277620934,0.128408072855122,0.0191,0.0731566037735849
GO:0034379,"very-low-density lipoprotein particle assembly",7,"ACSL3, SOAT1, APOC1, MFSD2A, LPCAT3, MTTP, ARF1",0.0489494200813375,0.0329863661913984,0.129270894533859,0.02622,0.096425
GO:0043171,"peptide catabolic process",6,"TPP1, ACE, LNPEP, TRHDE, ADAMTS13, IDE",0.191958321629808,0.0331954651277666,0.129923125082326,0.01272,0.0525541383989145
GO:0046426,"negative regulation of JAK-STAT cascade",7,"BCL3, NEUROD1, SOCS2, DAB1, NF2, PTPRD, SH2B3",0.0681321160002984,0.0332431342522739,0.129942674965563,0.01174,0.0490374485596708
GO:1902742,"apoptotic process involved in development",5,"XKR8, XKR9, XKR4, SIX3, XKR6",0.0732296650029683,0.0336133802105184,0.13104269802498,0.0206,0.07840875
GO:0042475,"odontogenesis of dentin-containing tooth",22,"TBX1, TNC, RUNX2, CTNNB1, ROGDI, SOSTDC1, BCL2L11, FOXC1, LEF1, NF2, ACVR2B, ADM, PDGFRA, MSX1, ACVR2A, CTNNA1, GLI3, HDAC2, WNT6, BCL11B, SMO, JAG2",0.0514844255987477,0.0336415727630069,0.13104269802498,0.05016,0.161626666666667
GO:0007023,"post-chaperonin tubulin folding pathway",5,"TBCD, TBCC, TBCA, TBCEL, TBCE",0.0920402074657921,0.0336966403661938,0.13104269802498,0.00674,0.0305861400894188
GO:0032467,"positive regulation of cytokinesis",13,"CDC6, DRD2, CUL3, PKN2, KIF3B, CDC14A, RACGAP1, KIF23, TAS2R13, CDC42, CIT, GIPC1, CDC14B",0.0828005521682292,0.0336966937778521,0.13104269802498,0.01718,0.0674137886597938
GO:0045445,"myoblast differentiation",9,"LGALS1, PLEKHM3, IGF1, MBNL1, MAML1, ITGB1, RB1, HMGCR, DDX5",0.0791425311875026,0.034355013936807,0.133432420200991,0.0103,0.0439264705882353
GO:0045667,"regulation of osteoblast differentiation",8,"SNAI2, SMOC1, ESRRA, ATF4, GLI1, DDX5, FGFR2, RASSF2",0.0844510695745674,0.0344072428834787,0.133465037681774,0.02746,0.100138562874251
GO:0010468,"regulation of gene expression",102,"ADNP, SLC8A1, TARDBP, NPAT, C1D, TFEB, ZNF827, RICTOR, SLC8A2, CDH1, TRIM44, AFF2, PIK3CA, TMEM107, DNMT3B, FEZF2, ATP1B1, TRIM22, NFKBIZ, PCBP3, COMP, STK40, NELL1, PRDM2, TRIM27, ASCL1, ZNF407, IGF1, YBX1, ANKRA2, APLNR, TRIM11, GNRH1, TAF10, PRDM5, HNRNPDL, PRDM11, AFF1, PROX1, CAVIN4, TRIM14, CACTIN, DNMT3A, ZFP36L1, EDN3, IGF2BP3, PHGDH, NANOG, INSM1, SORT1, PTPRC, STX1B, TSHZ1, MYC, ADNP2, TRIM61, CDK6, GNB3, STAU2, PCBP2, TOB1, STOX1, ZNF711, TSHZ2, ZFP64, PEG3, RFXANK, ROM1, BCL2, NOVA2, NHLRC1, YBX3, C9orf116, POGZ, AFF4, PCBP4, TRIM68, NIPBL, CLN3, DAXX, APBA1, AIF1, PTHLH, SIRPA, RBBP7, PIN1, TREM2, ZNF462, YBX2, TRIM26, PHLDA2, AHR, TRIM17, TRIM58, TGFBR1, FOXP1, MARF1, TSPAN8, PRDM1, TSKU, NOVA1, RBBP4",0.0333625849591776,0.0345920147497497,0.134011049507618,0.02396,0.0893001223990208
GO:0003094,"glomerular filtration",8,"TMEM63C, EDNRA, TBC1D8B, SULF1, ADGRF5, MYO1E, MCAM, SULF2",0.108555158149154,0.0348010282447113,0.134649467605014,0.03572,0.122901016949153
GO:0031398,"positive regulation of protein ubiquitination",42,"FBXW7, CHFR, PRICKLE1, LRRK2, NHLRC1, CRY1, TSPYL5, SPRTN, NDFIP1, BRCA1, CENPX, CENPS, AMER1, STUB1, RCHY1, BCL10, RASSF5, CBLB, UBE2D1, BIRC3, CUL3, PTTG1IP, ARRB1, FKBP1A, RIPK2, WFS1, PELI1, DNAJA3, SENP2, TICAM1, SPHK1, DERL1, NDFIP2, UBE3A, PHF23, LAPTM5, PAXIP1, FAM107A, FANCI, ANGPT1, FBXO33, PINK1",0.0564908621071802,0.0352184610853077,0.135904503443339,0.03266,0.114970751445087
GO:0055085,"transmembrane transport",140,"ABCG4, SLC25A25, SV2C, MFSD14A, ABCC5, RPS27A, PSMD4, ABCD4, KCNJ11, SLC33A1, AQP4, SLC49A3, UBA52, NIPA1, BCL2, SLC25A17, TAP2, SLC35B1, PSMD2, PSMD9, SLC12A8, SLCO1C1, MFSD2A, SLC10A3, SLCO2A1, ERLIN1, SLC22A23, PSMC1, ADD3, TAP1, SLC46A3, PSMB1, SLC16A9, MRS2, FLVCR1, PSME3, SLCO4A1, SLC25A18, SLC35B4, ABCA9, MPV17, MFSD9, ANO8, PSMD1, GJB1, SLC44A2, PSMD8, SLC4A9, ATP8A1, SLC5A6, ANO2, SLC4A11, SLCO3A1, SLC25A32, ABCC9, ABCA6, PSMA6, SLC35F1, PSMC2, RALBP1, SLC25A40, SLC19A2, TMEM241, PSMB8, SV2B, ADD1, SLC16A14, STEAP1, PSMD12, PSMB10, ADD2, OCA2, PDZD11, SLC4A2, EIF2S3, PSMB5, PSMD6, SLC19A1, ABCB6, PSME1, SLC25A23, TUSC3, PSMC3, SLC25A36, ABCG2, ABCC1, VCP, GPR155, ABCC6, ABCB7, PSMB6, ABCA7, ATP6V0E2, ANO10, CNNM1, SLC35F2, SLC44A5, SLC14A1, LRRC8C, PSMB7, SLC44A3, LRRC8A, PSMA7, CYB561D1, DERL1, ABCA5, SLC25A48, MFSD8, MFSD14C, CYB561A3, ANKH, PSME2, AQP5, SLC4A3, ABCB9, PSMD7, SLC10A4, ABCC8, AZGP1, SLC2A13, PANX2, SLC16A6, SLC4A8, SPNS2, SLC22A10, ANO7, PSMA5, SVOP, SLC47A1, EIF2S2, SEM1, SLC25A22, SLC35E3, GJC2, ANO3, LRRC8B, ANO5, PSMB2, ABCC12, ABCG1",0.0546575737487952,0.0352356423312378,0.135904503443339,0.02146,0.0811747826086957
GO:0006893,"Golgi to plasma membrane transport",10,"ARFGEF2, RAB10, STEAP2, EXOC5, GOPC, STXBP6, ARL3, EXOC6, OSBPL5, RAB3IP",0.11413794757824,0.0352975910893164,0.135904503443339,0.02982,0.106325409836066
GO:0051276,"chromosome organization",6,"CENPW, MYC, GEM, PTTG1, PTTG2, SMCHD1",0.0808356824202116,0.0353039284806834,0.135904503443339,0.00762,0.0341219117647059
GO:0010042,"response to manganese ion",6,"PTGS2, TFRC, FIBIN, ADAM9, SOD2, TSPO",0.0866033169368483,0.0354134487567266,0.136153979121506,0.0396,0.133239779005525
GO:0008654,"phospholipid biosynthetic process",21,"SELENOI, HEXB, SERAC1, AGPAT3, LPCAT1, PPARD, PCYT2, MBOAT2, CRLS1, CHPT1, FITM2, TMEM38B, GNPAT, LPGAT1, SERINC1, AGPAT1, GPAT3, MBOAT1, ISYNA1, FADS1, AGPAT4",0.0651487198166914,0.0356100516101018,0.136737209524287,0.0094,0.0407155049786629
GO:0048024,"regulation of mRNA splicing, via spliceosome",7,"YTHDC1, TIA1, SRPK1, KHDRBS2, CWC22, JMJD6, RBM39",0.263824770270102,0.0358623235395902,0.137532462440872,0.0025,0.0136424731182796
GO:0018243,"protein O-linked glycosylation via threonine",5,"GALNT2, GALNT3, GALNT1, GALNT13, GALNT16",0.119319508886116,0.0360342919187564,0.138018136971841,0.04078,0.136456153846154
GO:0002446,"neutrophil mediated immunity",5,"KMT2E, CARD9, WDR1, ACE, IL6R",0.180200367962391,0.0361877956377267,0.138431956930751,0.00072,0.00504
GO:1901017,"negative regulation of potassium ion transmembrane transporter activity",5,"CAB39, NEDD4L, STK39, ACTN2, OXSR1",0.226363218464451,0.0364306338715878,0.139088260686963,0.02896,0.104482464454976
GO:0015695,"organic cation transport",5,"SLC7A8, SLC22A18, SLC29A4, SLC47A1, SLC22A4",0.103505086317271,0.0364507165938247,0.139088260686963,0.03724,0.126840939597315
GO:0099645,"neurotransmitter receptor localization to postsynaptic specialization membrane",7,"CACNG7, CACNG3, CACNG2, ADAM22, NPTX1, DLG4, DLG1",0.110645478952568,0.0366349758192108,0.139616397208382,0.04132,0.137808762322015
GO:2000369,"regulation of clathrin-dependent endocytosis",5,"PIK3CB, AAK1, BMP2K, SNAP91, TNK2",0.195491985879902,0.0370927531485492,0.141184291671665,0.00628,0.0288861027190332
GO:0010447,"response to acidic pH",6,"SLC9A1, ASIC2, GPR4, SST, ASIC1, SERPINF1",0.049907781966699,0.0373888621658528,0.142133689506894,0.03224,0.113623611111111
GO:0006303,"double-strand break repair via nonhomologous end joining",22,"ERCC1, PAXIP1, RNF8, HMGB1, UIMC1, POLB, BARD1, RNF168, IFFO1, TP53BP1, NSD2, HMGB2, BRCA1, XRCC4, SETMAR, MDC1, BABAM1, RIF1, BABAM2, ERCC4, DCLRE1C, DCLRE1A",0.0999513089356554,0.0378023895695272,0.143526528976571,0.01674,0.0660275906735751
GO:0045736,"negative regulation of cyclin-dependent protein serine/threonine kinase activity",12,"CDKN2C, IPO5, CDKN1C, CEBPA, NR2F2, CDKN2A, CASP3, HEXIM1, HHEX, CDKN1B, CDKN2D, IPO7",0.0550566680426762,0.0382661823302213,0.145106507092807,0.0575,0.180316683831102
GO:0006497,"protein lipidation",10,"ATG7, ATG16L1, ABCA1, ATG5, MTTP, WDR45, WIPI1, ATG16L2, ATG12, WIPI2",0.0882815886453729,0.0384680474536698,0.145538479365164,0.04552,0.149912756756757
GO:0090503,"RNA phosphodiester bond hydrolysis, exonucleolytic",14,"CNOT6L, DCP2, TOE1, DIS3, EXD2, PAN2, USB1, PNLDC1, ANGEL1, DIS3L2, ANGEL2, CNOT7, DCPS, PNPT1",0.14307550150018,0.0385303361321405,0.145538479365164,0.01482,0.05985
GO:0030163,"protein catabolic process",19,"IDE, PSMC1, LONP1, LNPEP, CLN6, PJA1, UCHL3, TRIM24, PRSS16, PSMC2, CAPN3, SIAH1, EXT1, LRSAM1, CLPX, PSMC3, RNF165, TPP1, IL17RA",0.0691811130678394,0.0385536445811363,0.145538479365164,0.05046,0.16224994720169
GO:1900017,"positive regulation of cytokine production involved in inflammatory response",9,"TICAM1, APPL1, CD6, TNF, IL17RA, CARD9, ANKRD42, IL17D, TLR4",0.131910693734155,0.0386025916225234,0.145538479365164,0.00796,0.0353326530612245
GO:0006816,"calcium ion transport",49,"CACNA1A, CACNA1B, SLC3A2, STIM1, CACNG3, CACNB3, CAMK2A, PANX1, PKD1, CACNG8, CACNA1C, GRIN3A, CCR5, PRKCB, ITPR1, CCR1, ATP2C1, ATP2B2, TRPC4, RYR2, PPP3CA, TPT1, TRPC1, PSEN2, SLC8A2, TRPC5, CACHD1, KCNN4, TRPM2, STIM2, CORO1A, EFHB, PKD2, ANXA6, CACNA1E, CACNG6, RYR1, CACNA2D3, BSPRY, EPM2A, CACNA2D1, CHRNA4, SLC8B1, TRPM7, TRPC3, SLN, RAMP3, CACNG7, RYR3",0.0320619318767298,0.0386190776115114,0.145538479365164,0.04012,0.134840397350993
GO:0030148,"sphingolipid biosynthetic process",25,"SPNS2, PRKD1, SPTLC1, ELOVL4, CERS1, DEGS1, VAPB, PPM1L, CERS6, HACD4, HACD2, CERS4, SGPP2, PLPP1, SAMD8, VAPA, SPHK1, SPTSSB, FA2H, ELOVL7, SPHK2, HACD1, PLPP3, SPTSSA, ELOVL1",0.0790266029197442,0.0388145411094493,0.14609428637611,0.00698,0.0315811292719168
GO:0070544,"histone H3-K36 demethylation",6,"RIOX2, KDM4B, KDM4C, PHF8, KDM7A, KDM2B",0.143721970080971,0.0389890630575311,0.146569996308867,0.00562,0.0264087962962963
GO:0042462,"eye photoreceptor cell development",7,"MYO7A, PRDM1, PRKCI, RORB, OLFM3, PAX6, VEGFA",0.0621630632802199,0.0391571334009819,0.147020309748446,0.01906,0.0730953400503778
GO:0033120,"positive regulation of RNA splicing",6,"SRSF5, HSPA1A, SLC38A2, PIK3R1, SRSF1, RBM22",0.185804932066392,0.0392848552962632,0.147318207360987,0.00116,0.00738953974895397
GO:0006939,"smooth muscle contraction",10,"BDKRB2, MYLK, ADRA1A, ROCK1, ROCK2, FKBP1B, CHRM3, APBB1, EDNRA, HTR7",0.0676071252268839,0.0393588192052124,0.147414027650519,0.02488,0.0922772228989038
GO:0007275,"multicellular organism development",221,"VANGL2, TSHZ3, PBXIP1, EYA2, OLFML3, WNT10A, DDX25, DDR1, FGD1, TUBD1, GREB1, NOTCH4, POGK, PHC3, ERBB2, FSTL4, SPRY4, FGFR3, EPHA4, SLC26A8, NFATC3, WNT4, PLXNA3, ALK, PTP4A1, DIAPH2, WLS, HELLS, FZD6, ERC1, TPI1, CDH12, POU6F2, VWC2L, FGFR1, ENC1, RORA, KIT, GADD45B, EPHA5, CRABP1, NTRK3, LTBP4, CDH7, SPIN1, RYK, NKX3-1, MNT, ZNF74, CREM, EPHB3, TLL2, SPRY1, KREMEN2, CHST2, NELFA, CDH8, ZFP36L1, WNT6, KCTD15, EYA4, SPATA6, FLT1, DPY19L2, RREB1, GPX4, GRIN2B, TIE1, MET, FGFR2, KDM1B, CDH22, LMO2, WDFY3, DCHS1, SOHLH1, ERG, WDR47, FZD2, CACTIN, SCUBE2, WIPF3, FZD10, MEA1, TCFL5, SPDEF, TEK, FLT3, DLL3, PDGFRA, ZMYM3, HUNK, CLPTM1, SIAH3, ADAMTS9, EDN3, DCAF7, MST1R, WNT5A, PIWIL4, TDRD1, DVL1, ZMYM6, MC1R, NTRK2, TDRD9, CELSR3, WNT7B, EDARADD, APOL2, MERTK, MRAS, RNF43, DND1, DVL2, BEX3, PDGFD, SPATA20, CREG1, WNT2B, NKX1-2, TYRO3, DDX1, ZNF45, MBNL3, RECQL4, EPHA6, EPHA10, TSHZ2, LTK, ARIH2, RORB, OBSCN, OSTN, EYA3, PIM1, DKK3, EDIL3, EPHA3, HACD1, HLF, EPHB1, WIF1, DGKD, SIAH1, CSF1R, TMEM88, G2E3, PAX6, CDK13, PHC2, PLEKHB1, KAZALD1, RET, CDH6, CEP131, CDH11, LDB1, POMT1, FMN2, CDH9, CDH10, FZD9, STRBP, HMGB3, FLT4, RYBP, GPR161, ZNF541, MINK1, ZNF7, EPHB2, ODF2, LBH, LIF, SORT1, TLE1, DMBT1, FSTL1, TXNRD3, DAB2, ZNF267, ANGPTL2, DACT1, GGN, ADCYAP1R1, CUX1, CHRD, PPDPF, MICAL2, GREB1L, ARHGDIB, LCLAT1, CSRP2, SUFU, INSR, WNT10B, ZMYM4, EPHA7, KREMEN1, DONSON, UNC5D, CADM1, PLXNA1, LEPR, CDK20, ZNF3, DDX11, TDRD6, PAX8, CCDC120, FSTL5, EPHB6, SIAH2, GTF2IRD1, GNRH1, LMTK2, SSC5D, PRELID1, PAQR8, HHAT",0.0279439342734525,0.0395017570854054,0.147767629391965,0.045,0.148778501628664
GO:0010628,"positive regulation of gene expression",206,"TWIST1, RAMP3, AGO1, BLNK, ID4, FAM98A, PAWR, IL7R, DTNBP1, FOXC1, DNMT3B, EPHB2, CRH, SMO, LMNA, NOS1AP, TRIM24, WNT3, SMAD3, ATP13A2, ACTG1, LGALS9C, HES1, LAMTOR5, FGF2, EZR, CLU, MARK1, TTN, TREM2, SMAD1, ACTA1, SLC38A2, LRRC32, PID1, CTNNB1, ERBB2, CD74, ITGAX, POU3F3, DDX3X, LDLR, AR, RET, ATF4, LEF1, EPB41L4B, CAMK2N1, RPS3, BRAF, PKD2, MAPK11, PPARG, SLC2A10, MST1, OLFM1, CNN2, SOX8, TTC21B, CLDN5, IL34, SERPINB9, DNAJA4, ROBO1, MED23, GAS6, DHX36, PRKAB1, MSN, TLR4, CUX2, FAM98B, FGF7, NRXN1, UBR5, RIMS1, MAFG, CDH3, HSPA1A, SLC24A4, MYOM1, MAPK3, PIAS3, ROCK1, FGF18, SLC24A3, STAR, ZBTB7B, FOXD1, PPARD, ID2, PIK3CD, TFRC, NR1H2, CNGB1, SMAD2, WNT10A, DDRGK1, CNTN1, PAX6, GABPA, PRDM1, GJC2, TESC, CITED2, SOX11, ITGB8, MYLK2, CDKN2A, SCX, FGF9, KRAS, TLR2, NTRK2, WNT7A, E2F1, WNT5A, BMP6, CEBPA, SNF8, KDM4C, STOX1, DRD1, OVOL2, PDCL3, PDE2A, RUNX2, CELF1, TLR3, PDCD5, MEF2A, ACTC1, BRCA1, TNRC6A, VPS35, ARX, WNT6, MYCN, MAP2K1, AGO4, MYC, CALR, PLAG1, TNF, NKX3-1, TNRC6C, AFDN, ROCK2, MT3, NKX2-2, HEY1, RBM4B, CTSH, PKP3, MEF2C, CYP26B1, IGF1, SOX17, IL33, FGF17, CALCOCO1, RPS6KA2, NFAT5, GPER1, PIK3CB, IL1B, EGR1, NTRK3, RPL23, VEGFA, NRL, PLCG2, PPARGC1A, RIMS2, TYROBP, INHBA, ANK3, VSTM2A, ANGPT1, POU3F1, HPN, MITF, PDGFB, KAT6A, CDK6, AMH, TICAM1, TOR2A, ADTRP, FN1, NWD1, TNC, RPL5, LIF, KDM5B, GJA1, MAPK1, PLP1, RELB, NTSR1, GSN, BCL11A, TLE1, TGFBR1, NRG1, AGO3",0.0541807928393776,0.0395518876077073,0.147773616890146,0.03052,0.108440373395566
GO:0045930,"negative regulation of mitotic cell cycle",18,"CDKN1B, BTG3, SMAD3, BRINP2, NKX3-1, TRIM35, NLE1, FOXC1, TNF, BRINP1, RFPL1, CDKN1C, PTPN3, BTG1, BRINP3, HECA, TIMP2, ANGEL2",0.0730228025924749,0.0396377444866687,0.147912906816061,0.03578,0.122968510158014
GO:0010867,"positive regulation of triglyceride biosynthetic process",10,"MFSD2A, PLIN5, LDLR, NR1H2, CNEP1R1, SREBF1, GPLD1, DGAT2, NR1H3, RGN",0.100803084518556,0.0398262447556808,0.1484344128287,0.02948,0.105607764705882
GO:0022408,"negative regulation of cell-cell adhesion",7,"EPB41L5, LEF1, JAK2, GTPBP4, NF2, CDH1, SPINT2",0.0566624207355171,0.0401428921795558,0.149431670766195,0.03128,0.111011188811189
GO:0003148,"outflow tract septum morphogenesis",13,"ROBO2, ZFPM2, TBX1, SMAD6, ROBO1, LRP2, NRP2, RARB, ISL1, SEMA3C, FGFR2, NRP1, PARVA",0.0745629609249221,0.040195334952105,0.149444194052698,0.00954,0.0410300847457627
GO:1904659,"glucose transmembrane transport",12,"MFSD4B, SLC2A6, SLC45A1, SLC2A1, SLC5A11, SLC5A4, SLC2A12, MFSD4A, SLC2A5, SLC2A10, PPARD, SLC2A11",0.0588849164297227,0.0403125090662477,0.149697061105761,0.00642,0.0293527027027027
GO:0045672,"positive regulation of osteoclast differentiation",8,"TREM2, FOS, KLF10, CCR1, TNF, GNAS, PPARGC1B, TMEM64",0.0844846771410509,0.0403847693030988,0.149782731459118,0.0092,0.039962910128388
GO:0021522,"spinal cord motor neuron differentiation",8,"LMO4, GIGYF2, DYNC2H1, ISL1, IFT172, NKX2-2, PTCH1, SOX4",0.0599871842438904,0.0404654734557393,0.149899472837866,0.04084,0.136506915477497
GO:0009267,"cellular response to starvation",43,"LRRK2, WNT2B, INHBB, CLEC16A, EHMT2, SRD5A1, SFRP1, MAP1LC3B, MFSD2A, RRAGD, CARTPT, TFEB, WIPI2, MAP1LC3A, ATG5, RALB, STK24, GBA, ALB, NUPR2, STK26, JMY, MAX, SREBF1, ZFYVE1, KLF10, WNT4, FOXO1, WIPI1, RRAGB, AKR1C3, DNAJC15, USP33, CTSV, WDR45, ATG7, GAS6, VPS41, RRAGC, HSPA8, TNRC6A, SIRT1, FADS1",0.0355526202458238,0.040741489278575,0.15073855996751,0.05276,0.167348125
GO:0046512,"sphingosine biosynthetic process",10,"ASAH1, SPTSSB, SPHK1, GBA, ASAH2, SPTSSA, AGK, SPHK2, SPTLC1, ASAH2B",0.107143156433081,0.0409439113066541,0.151239294161625,0.02916,0.105079526627219
GO:0060770,"negative regulation of epithelial cell proliferation involved in prostate gland development",5,"WDR77, SERPINF1, NKX3-1, CDKN1B, EAF2",0.0950703636964995,0.0410153669247166,0.151239294161625,0.01408,0.0572411214953271
GO:0030837,"negative regulation of actin filament polymerization",9,"PFN1, KANK4, SSH3, PRKCD, MYADM, KANK3, FHOD3, MKKS, PFN2",0.139163402713655,0.041032669169629,0.151239294161625,0.00974,0.0417722535211268
GO:0016926,"protein desumoylation",6,"HINT1, SENP7, SENP6, SENP1, USPL1, SENP2",0.0871006823117789,0.0410754995966056,0.151239294161625,0.03804,0.128559156492786
GO:0007040,"lysosome organization",25,"ABCA1, TPP1, CLVS2, GBA, BECN1, TFEB, CLN6, LYST, AP3B1, LRRK2, CLN3, VPS35, NAGLU, NAGPA, ARSB, MFSD8, CLVS1, HPS1, LAMTOR1, AKTIP, HEXB, SNAPIN, GNPTAB, MYO7A, GRN",0.0471854276704513,0.0411601772196961,0.151368043036201,0.0221,0.0833884758364312
GO:0030514,"negative regulation of BMP signaling pathway",25,"SFRP1, VWC2, WNT5A, BAMBI, CHRDL1, LEMD3, LRP2, TRIM33, TOB1, SPART, SKIL, CHRD, VWC2L, SOSTDC1, SMAD6, SMAD1, PPARG, SMAD9, ACVR2B, CRIM1, ACVR2A, SKI, FZD1, SORL1, UBE2D1",0.044225859822268,0.0415808609186124,0.15273066525594,0.0616,0.191134215885947
GO:0043101,"purine-containing compound salvage",6,"APRT, GMPR2, GMPR, ADK, AMPD3, PNP",0.118816469111111,0.0416380915540577,0.152756612990489,0.01054,0.0448244413407821
GO:0070286,"axonemal dynein complex assembly",6,"CCDC39, CCDC103, TTC12, CCDC65, DRC1, DNAAF2",0.111131933216906,0.0417857254280561,0.152854137807681,0.00718,0.0323418639053254
GO:0071578,"zinc II ion transmembrane import",5,"SLC39A4, SLC39A12, SLC39A10, SLC39A14, SLC39A8",0.132592967405836,0.0418316229158627,0.152854137807681,0.03196,0.113160697674419
GO:0090394,"negative regulation of excitatory postsynaptic potential",6,"CBLN1, S1PR2, LRRK2, CELF4, MTMR2, NLGN4X",0.0812792611628455,0.0418322411196419,0.152854137807681,0.0374,0.126959866220736
GO:0018108,"peptidyl-tyrosine phosphorylation",71,"CSF1R, MAP2K5, ABI1, JAK1, CAMKK2, EPHA4, NTRK3, FGR, STYK1, INSR, LTK, PDGFRA, EPHA6, CLK3, DYRK2, TEK, MAP2K4, KIT, MERTK, ALK, DYRK4, MAP2K2, TNK2, EPHB2, EPHA3, MAP2K7, DYRK3, NTRK2, TTN, MST1R, EPHA10, TYK2, FGFR3, RIPK2, PDGFB, PRKCD, HCK, PTPN4, MAP2K1, TIE1, MATK, PKDCC, EPHB6, FLT3, EPHA5, EPHB3, LMTK2, TYRO3, FGFR1, BCR, LYN, FLT4, NEK1, EFEMP1, FLT1, MAP2K3, IL12RB2, EPHA7, SYK, ERBB2, RELN, RET, EPHB1, FGFR2, JAK2, MET, FRK, RYK, MAP2K6, CLK4, FES",0.043814291418016,0.0418654682862417,0.152854137807681,0.02566,0.0945940677966102
GO:0045046,"protein import into peroxisome membrane",8,"PEX19, RAB8B, ATAD1, PEX12, FIS1, SLC25A17, ABCD2, PXMP4",0.0719889881220291,0.0420810870015398,0.153392069003978,0.0372,0.126840939597315
GO:0006654,"phosphatidic acid biosynthetic process",22,"GNPAT, LCLAT1, DGKH, GPD1, AGPAT4, GPAT3, DDHD2, DGKB, GPD1L, DGKI, AGPAT3, DGKD, DDHD1, PNPLA3, PLA2G4A, AGPAT1, LPCAT1, DGKA, PLD6, DGKG, LPCAT4, PLA2G5",0.0327218790796462,0.0421276136191656,0.153392069003978,0.04836,0.156822364217252
GO:0033189,"response to vitamin A",9,"DNMT3A, RBP1, PPARG, MAP1B, CYP26B1, FADS1, PPARD, DNMT3B, CYP26A1",0.0605716047571873,0.0421639283272017,0.153392069003978,0.04622,0.151496124865447
GO:0045598,"regulation of fat cell differentiation",8,"DLK2, NR1D1, GNB3, HES1, GRIP1, ALOX5, PPARD, TNF",0.0711007288235361,0.0423450285912652,0.153867078831029,0.01672,0.0660275906735751
GO:0044255,"cellular lipid metabolic process",10,"ZMPSTE24, ZNF670, DIO2, FAM135A, ABHD3, STAR, ABHD1, GNPAT, CCDC71L, FAM135B",0.0786542092248836,0.042665177187416,0.154845607313089,0.05466,0.172297826086957
GO:0035735,"intraciliary transport involved in cilium assembly",22,"IFT22, DYNLL2, DYNC2H1, IFT122, KIF3B, TRIP11, TTC30B, IFT74, IFT172, CEP131, DYNLL1, SSX2IP, TNPO1, TTC21B, IFT27, KIFAP3, HSPB11, IFT20, KIF17, WDR19, KIF3C, IFT57",0.0508606646084302,0.0427372308789102,0.15492246193605,0.03508,0.121384772727273
GO:0016197,"endosomal transport",42,"ABCA1, BLOC1S2, UBA52, UBAP1, REPS2, AP5M1, RAB10, STAM2, ANKFY1, AGAP2, KIAA1109, ARL8B, AP5B1, DCLK1, VPS37D, CHMP2A, AP5S1, CLEC16A, RPS27A, NSG2, WASHC1, NSG1, SNF8, VPS36, RAB35, LAMTOR1, VPS25, CHMP4A, ITSN2, TMCC1, ARHGAP1, REPS1, VPS37B, SNX9, WASHC4, CHMP4B, EHD2, MYO5B, ZFYVE9, RAB13, VPS37C, EHD1",0.0432305377980014,0.0434316559021394,0.157195655669343,0.05154,0.164398115183246
