cLabel,cDesc,cSize,cGenes,cScorePheno,pValZ,pValZCorr,pValPerm,pValPermCorr
GO:0051004,"regulation of lipoprotein lipase activity",6,"LIPC, GPIHBP1, PCSK6, LPL, PCSK5, LMF1",0.0559499630644833,0.281184290857036,0.617307978125215,0.30578,0.6650715
GO:0032465,"regulation of cytokinesis",22,"RAB11FIP3, PIN1, RAB11FIP4, RAB11A, MYO19, PLK5, ZFYVE26, CALM2, PRPF40A, PDXP, CALM1, BIRC6, PLK2, BECN1, PRC1, SH3GLB1, CALM3, KLHL13, GIT1, FSD1, CETN2, KLHL21",0.0226655643523427,0.2820994282478,0.618870863843337,0.3146,0.678784844192635
GO:0001782,"B cell homeostasis",11,"PPP2R3C, TNFSF13B, BCL2, SPNS2, MEF2C, CAMLG, SOS1, CASP3, LYN, BCL2L11, BAK1",0.0181031029006134,0.282548873779408,0.619410598026133,0.27194,0.617492393736018
GO:0050679,"positive regulation of epithelial cell proliferation",27,"VEGFA, LAMB1, BAD, MAP2K5, LAMC1, FGF9, IGF1, ERBB2, FGFR2, WNT5A, SFRP1, SMO, FGF2, BMP6, NR4A3, MYC, WDR48, CYP7B1, HRAS, GRN, FGF7, TBX1, STOX1, TCF7L2, NME1, ZBED9, TWIST1",0.0303294122145799,0.283673615844614,0.62142889226392,0.30802,0.668034829059829
GO:0035331,"negative regulation of hippo signaling",7,"SHANK2, MAP2K3, WTIP, WWC2, DLG5, CIT, WWC1",0.0271130472965215,0.283987943570743,0.621670228736818,0.28006,0.628432350773766
GO:0048704,"embryonic skeletal system morphogenesis",8,"HOXD9, SATB2, FLVCR1, DSCAML1, COL11A1, SOX11, PDGFRA, DLG1",0.026754199728282,0.284746090274658,0.622882072475814,0.31062,0.671672107877928
GO:0007173,"epidermal growth factor receptor signaling pathway",18,"NCK2, DGKD, PIK3CA, SOS1, CAMLG, REPS2, BRAF, SOCS5, IQGAP1, EFEMP1, KIF16B, SHC1, SHC3, PLCE1, PIK3R1, SLC30A10, BTC, BCAR1",0.017873865492564,0.285538655632215,0.624039440467718,0.34152,0.710319986357435
GO:0031333,"negative regulation of protein complex assembly",19,"CRYAB, STXBP1, TMC8, GBA, ISL1, SORL1, DNAJC15, CTNNBIP1, NOP53, DDX3X, SVIP, IMPACT, CLU, CDC42, AKAIN1, EIF4EBP1, LMO4, ULK1, LCMT1",0.0317244348021061,0.28574891624879,0.624039440467718,0.29058,0.644439985433358
GO:0045830,"positive regulation of isotype switching",7,"PAXIP1, KMT5B, TFRC, HMCES, RIF1, MAD2L2, TP53BP1",0.0249510720025338,0.285889989967969,0.624039440467718,0.30446,0.663622548317824
GO:0071356,"cellular response to tumor necrosis factor",55,"PYCARD, NKX3-1, RORA, CYP1B1, TNFRSF21, GPD1, GBP3, CCL2, CHUK, GFER, RPS3, MAP3K5, CACTIN, SMPD3, EDN1, GSDME, DHX9, ADAMTS13, CD58, FOXP1, ZFAND6, TRADD, PID1, ZFP36L1, HES1, ASS1, INPP5K, PCK2, ZFP36L2, SFRP1, CEBPA, SIRT1, GBP2, TANK, GBA, NR1D1, CHI3L1, IKBKB, KLF2, ASAH1, HYAL3, ZNF268, PPARGC1A, HDAC4, MAPK1, NPNT, KCNJ11, NFKB1, GPER1, AKAP12, CRHBP, CIB1, BRCA1, MAPK3, YBX3",0.0204324847178031,0.286173459079285,0.624210732733828,0.33652,0.708193181818182
GO:0042776,"mitochondrial ATP synthesis coupled proton transport",8,"ATP5PB, ATP5ME, ATP5MC3, STOML2, ATP5F1A, ATP5MF, ATP5F1B, ATP5PF",0.095798965931845,0.286432332970814,0.624328170290714,0.30248,0.661675
GO:0042552,"myelination",23,"EIF2B5, XK, CLDN5, MBP, KLK6, FAM126A, GAL3ST1, ERBB2, ADGRG6, SBF2, BCAS1, SCN2A, MAL2, CMTM8, TSC1, EGR2, MALL, TSPAN2, TNFRSF21, SCN8A, EIF2B2, HEXB, NAB1",0.0204885011376197,0.286836448159323,0.624761791591658,0.32388,0.691494533987386
GO:0033622,"integrin activation",6,"FERMT2, COL16A1, KRIT1, CXCL12, FN1, ITGB1BP1",0.037146603624447,0.287582153550999,0.625938282746814,0.32162,0.689343459915612
GO:0022904,"respiratory electron transport chain",14,"MYBBP1A, ETFRF1, UQCRFS1, SDHB, ETFA, ETFDH, PPARGC1A, SDHA, PINK1, SCO2, ETFB, GBA, SOD2, AIFM2",0.0680665400352053,0.287946162332775,0.626282903073786,0.30104,0.660422766570605
GO:0043129,"surfactant homeostasis",6,"SFTPD, ADGRF5, VEGFA, CTSH, LPCAT1, RCN3",0.0301878959293252,0.288807266861962,0.627707442965506,0.30958,0.670940284697509
GO:0006809,"nitric oxide biosynthetic process",11,"NOS2, RORA, NQO1, NOS1, ARG2, DDAH2, SPR, CYB5R3, CYB5B, CYP1B1, GCHFR",0.0241995271603742,0.289811161002135,0.629110950185929,0.29678,0.65485152173913
GO:0030890,"positive regulation of B cell proliferation",20,"SLC39A10, TFRC, BCL2, CD38, PTPRC, PELI1, CD81, MIF, CD320, TLR4, VAV3, TIRAP, EPHB2, MEF2C, TICAM1, GPR183, TNFRSF4, TNFSF13B, CD74, ATAD5",0.0310247523804416,0.289866227622614,0.629110950185929,0.35788,0.729902612190221
GO:0006995,"cellular response to nitrogen starvation",9,"GABARAPL3, GABARAP, ATG5, GABARAPL2, MAP1LC3B, ATG7, MAP1LC3A, MAP1LC3B2, BECN1",0.052643383673264,0.290140315399816,0.629257307971824,0.28474,0.636121276595745
GO:0060976,"coronary vasculature development",11,"DYNC2H1, AP2B1, PRDM1, PCSK5, SMAD6, CNTRL, PRICKLE1, SUFU, APLN, APLNR, PLXND1",0.0231762964452445,0.290409927640429,0.629393757768758,0.30194,0.660968583752696
GO:0006801,"superoxide metabolic process",11,"CCS, NOXO1, SH3PXD2A, SOD2, NCF1C, CYBB, SH3PXD2B, CYB5R4, SOD1, NOS2, PREX1",0.0272839969620083,0.291116304837553,0.630475923350178,0.33202,0.703060431154381
GO:0031397,"negative regulation of protein ubiquitination",29,"PER2, PRKCG, HSPA1A, SENP2, RASD2, TSPO, ATG5, HDAC8, SOX4, USP4, ARRB1, DNAJA1, GLMN, IVNS1ABP, NXN, UFL1, RPS3, BAG2, N4BP1, SIRT7, CDK5, CRY1, ISG15, GTPBP4, BAG5, CAMLG, SPOPL, PINX1, OGT",0.0256802091304649,0.292476532940557,0.632971601140012,0.32178,0.689343459915612
GO:0071277,"cellular response to calcium ion",59,"CPNE6, CRHBP, SYT13, ADCY1, SYT3, CPNE9, ADGRV1, INHBB, NLGN1, CPNE5, MEF2C, TRPM2, CPNE3, SYT5, ALOX5AP, EDN1, SYT1, ADCY8, CPNE4, HPCA, CPNE7, SYT15, BRAF, FOSB, NCSTN, SYT4, EEF2K, CPNE2, RYR3, PLCG2, RASGRP2, RASAL1, JUN, CHP2, RYR1, GPLD1, PRKAA2, CAPN3, WNT5A, ADD1, AKR1C3, SLC25A23, CPNE8, FOS, SYT10, SYT6, SYT12, IQGAP1, SYT17, MEF2A, CAMK2D, PKD2, KCNH1, PPIF, ENDOG, NEUROD2, MCOLN1, SYT2, NRXN1",0.0165435783023041,0.293476849831535,0.634685374813226,0.39068,0.768488759689923
GO:0015031,"protein transport",194,"S100A13, RAB2B, ARL3, NDC1, SCAMP5, AGAP1, VTI1B, EXOC6, NUP205, NBAS, STAM2, VPS29, VPS37C, ENY2, CETN2, HSPB11, CHMP2A, ABCB9, RAN, SEC22B, GPM6B, CENPF, RAB11FIP1, GABARAPL2, NACA, GABARAP, BTF3, COPZ2, TOMM5, COG2, LIN7C, PLEKHM1, RABIF, SENP2, PIK3R2, XBP1, SNX8, NMD3, SNX7, EXOC5, LMAN2L, SELENBP1, FRAS1, TESC, SNX3, NUP85, COG5, STXBP5L, SLC15A4, RILP, WASHC3, LIN7A, UBAP1, BBIP1, COPZ1, SPIRE2, ARHGAP33, CHMP1B, TOM1L1, FCHSD2, HSP90B1, CHMP1A, SERP1, MX2, GOLGA2, ARL8A, CHP2, BBS9, KLHL20, DENND2A, GOLT1A, SNX30, NSF, VPS54, RAB39B, ARL8B, BBS5, CD63, CADPS2, RAB4A, COG1, RAB35, SEC62, RAB37, AP1M1, PRAF2, ARRDC3, ARRB1, MLC1, MCFD2, AP5S1, ANKRD27, LRP2, LRP1B, MTX2, BBS7, AKTIP, KIF17, WASHC2A, JAKMIP1, DENND4C, LYST, SEC61A2, CORO7, TAP2, DENND1A, LSG1, AKAP8, TMEM9, TAP1, MYO1D, SNAP29, VPS37B, PKDCC, RINL, EHD1, APBA2, WASHC2C, FMN2, AP1S3, STXBP1, VAMP8, PLEKHA8, STXBP5, ACTN4, GOPC, MYO5A, RABEP2, TNKS, AP5B1, SCAMP3, EIF5A2, RAB36, PGAP1, BET1L, DNAJC14, ATG16L1, ATG4B, SEC22C, AFTPH, ADAMTS9, MVP, CCDC91, CETN3, MYO5B, RCN3, PHAX, ARRDC2, AGAP2, DENND1B, NXF1, SEC23A, LIN7B, ARFGEF2, SEC16A, TOMM6, VPS25, RAMP3, RAB11FIP5, MTX3, ASTN2, ANKRD50, LCA5, SEH1L, DAB2, DGKD, CADPS, VPS37D, GDI1, SNAP91, ATG16L2, WASHC1, ERC1, RHBDF2, SLC15A3, COG6, MAMDC4, AP5M1, AAAS, SNX21, SNX25, RAB33B, RAB7B, RILPL1, WASHC4, TIMM50, ATG7, SNX13, DMBT1, TTC8, SNX12, ATG4D, SNX22, SNX24",0.0189323604101527,0.29381352514388,0.634795847431272,0.33178,0.703041127348643
GO:0007033,"vacuole organization",5,"VPS11, EXT1, NDP, MAN2A1, FIG4",0.0352423485153289,0.294067821260948,0.634795847431272,0.33726,0.708193181818182
GO:0035641,"locomotory exploration behavior",8,"APOE, GAD1, UBE3A, DLG4, CRH, SHANK3, PENK, LRRK2",0.0230182761555055,0.29415334670789,0.634795847431272,0.25594,0.594460183066362
GO:0043252,"sodium-independent organic anion transport",6,"SLCO2A1, SLCO1C1, SLCO4A1, SLCO3A1, SLC16A2, SLC22A9",0.0290255928254101,0.294903608787288,0.635880378571773,0.2703,0.615554260089686
GO:0010944,"negative regulation of transcription by competitive promoter binding",5,"HHEX, DACH1, MAD2L2, BHLHE41, OVOL2",0.0604287559609242,0.295073554982567,0.635880378571773,0.35012,0.721136596893991
GO:0010288,"response to lead ion",7,"SPARC, STAR, MAP1LC3A, QDPR, BACE1, BECN1, DNMT3A",0.0621039825398255,0.29571411048312,0.636804849679051,0.31004,0.670982089552239
GO:0071320,"cellular response to cAMP",31,"EEF2K, PDE2A, PKD2, AKAP7, FDX1, RAP1B, AHR, CRHBP, GPD1, HCN1, ITPR2, AKAP6, ASS1, CYP1B1, EZR, INHBB, RAPGEF1, SLC8A1, STAR, SRD5A1, PENK, ZFP36L1, RAPGEF2, KCNQ1, INPP5K, IGFBP5, HCN4, AQP1, WNT10B, HCN3, HCN2",0.0320086201280047,0.296121982650363,0.636804849679051,0.3108,0.671672107877928
GO:0000045,"autophagosome assembly",31,"MAP1LC3B2, ATP2A2, GABARAPL2, WIPI1, RAB33B, ATG3, ATG16L2, ATG5, GABARAP, UBQLN2, ATG101, RAB23, MAP1LC3B, STX12, TP53INP2, GABARAPL3, ATG16L1, ATG12, MAP1LC3A, WIPI2, ULK1, ULK2, BECN1, WDR45, ATG7, BAG3, EMC6, NSFL1C, SYNPO2, PACS2, EPM2A",0.0311691591222859,0.296129939949273,0.636804849679051,0.295,0.651395939086294
GO:0006851,"mitochondrial calcium ion transport",13,"STOML2, PMPCB, SLC25A12, MICU3, MCUR1, YME1L1, MICU2, SLC25A23, PMPCA, MCUB, PARL, SLC8B1, MCU",0.0476800280197624,0.296839986023208,0.63763905844019,0.31608,0.680487561837456
GO:0035278,"miRNA mediated inhibition of translation",9,"EIF6, AGO1, TNRC6A, NOTCH4, TNRC6C, TRIM71, RBM4, AGO3, AGO4",0.0363516741887831,0.296936678117632,0.63763905844019,0.29934,0.657640909090909
GO:0009235,"cobalamin metabolic process",11,"CD320, TCN2, PRSS1, MMACHC, MMAB, ABCD4, MMAA, ABCC1, PRSS3, MTR, MTRR",0.027306554396856,0.29738417351525,0.638145652014341,0.30172,0.660968583752696
GO:0008203,"cholesterol metabolic process",38,"CYP27A1, LCAT, OSBPL1A, LDLR, APOL2, NSDHL, FDX1, PPARD, GBA, ABCA5, ABCA1, TSKU, LIPE, ABCG1, STAR, NPC2, CEBPA, INSIG2, HDLBP, ERLIN1, EBP, LDLRAP1, VLDLR, FDXR, LEPR, RXRA, SREBF1, SQLE, GBA2, APOL1, CH25H, CLN6, NFE2L1, APOE, SOAT1, LIPC, CYP7B1, OSBPL5",0.0303078642616642,0.297591732630662,0.638145652014341,0.3382,0.70875361321404
GO:0001934,"positive regulation of protein phosphorylation",98,"MOB1B, GAS6, FLT4, MARCO, NTRK2, SENP2, SIRT1, LRRK2, MOB3A, PRR5L, DVL1, ARRB1, ANGPT1, TREM2, IL1B, TNIK, MOB3B, CD6, C3, HLA-DRB1, EDNRB, DVL2, CCND1, PLAUR, PIN1, HGF, LEPR, VEGFC, TFRC, LYN, WDFY2, CCND3, HRAS, KRAS, INSR, ERBB2, FGF2, FGF9, MT3, IL34, TBX1, LIMK2, RAC1, GPNMB, RALBP1, FAS, ILK, DAB2, RASGRP1, TEK, FGF18, TNF, NTRK3, PRR5, XBP1, RALB, CSF1R, SEMA7A, MYDGF, FGF17, EPHA7, PINK1, PAK1, VEGFA, AKTIP, SLCO3A1, CD74, ADTRP, FZD1, CHEK2, ANXA2, CLIP3, CAMKK2, NKX3-1, CLN3, CARD14, KNDC1, DTNBP1, CIB1, EFNA5, ROCK2, ACVR2A, PECAM1, GPER1, CRH, PELI2, FGF7, FAXDC2, DAXX, STK4, FIZ1, ZNF268, AIF1, CDK2AP1, MOB2, FAM20A, SEMA4D, MAPK3",0.0221875700916061,0.29993676327449,0.642721635588192,0.347,0.716835142469471
GO:0032786,"positive regulation of DNA-templated transcription, elongation",7,"ELL3, ELL, SUPT16H, HMGN1, THOC1, CCNT1, THOC5",0.0364421177454456,0.300162180929026,0.642752349457724,0.39496,0.774143243243243
GO:0001836,"release of cytochrome c from mitochondria",16,"PMAIP1, MFF, BBC3, GGCT, FIS1, CLU, SOD2, BCL2, TIMM50, FZD9, BAK1, BID, JUN, IFI6, CCK, BAD",0.0497434326995142,0.301997700735827,0.646228389838786,0.31918,0.684921141649049
GO:0009411,"response to UV",18,"UBE2A, REV1, TRIM32, BRSK1, PRIMPOL, ERCC2, UBE4B, SPRTN, USP1, RPAIN, ERCC4, DDB2, UBE2B, CDKN2D, MAP2K7, ZRANB3, CASP3, USF1",0.016592046319914,0.30231010393909,0.646442602875371,0.31426,0.678667872340425
GO:0060213,"positive regulation of nuclear-transcribed mRNA poly(A) tail shortening",7,"TNRC6C, TOB1, CNOT7, TNRC6A, CPEB3, PABPC1, POLR2G",0.0191400651035713,0.304027386611747,0.649658520865101,0.31716,0.682028389830509
GO:0060371,"regulation of atrial cardiac muscle cell membrane depolarization",5,"CACNA1G, SCN2B, GJA1, SCN1B, SCN3B",0.0174541079323447,0.304461530882528,0.650129987052804,0.33314,0.704452291666667
GO:0019674,"NAD metabolic process",9,"NADK2, LDHA, QPRT, NMNAT2, NMRK1, CD38, NMNAT3, GPD1L, MDH1",0.0722570305905217,0.305260507057463,0.651379288009794,0.29096,0.644628270348837
GO:0032924,"activin receptor signaling pathway",10,"ACVR1C, INHBA, ACVR2B, ACVR2A, TGFBR1, SMAD2, ACVRL1, ACVR1, INHBB, SMAD3",0.0149762488147516,0.30564908843862,0.651751732699999,0.28562,0.637152307692308
GO:0006270,"DNA replication initiation",16,"PURA, CCNE1, MCM3, CDC34, MCM6, MCM5, MCM8, MCM7, PRIM2, GMNN, POLE4, ORC6, PRIM1, CDC6, RPA2, CDT1",0.0120325812680683,0.307127964117271,0.65410232156015,0.35678,0.729124228187919
GO:0050890,"cognition",28,"ADORA1, NSUN5, JAKMIP1, FAM107A, GPR155, NIPBL, SLC1A4, CHL1, CHRNA4, CHRM1, DGCR2, GNAS, GRM5, CYFIP1, C12orf57, TUSC3, SOBP, SLC8A2, TNF, LINS1, PTCHD1, MGAT3, RP9, HLA-DRA, HRH3, MFSD2A, CUX2, ST3GAL4",0.0161908071256888,0.307259780217978,0.65410232156015,0.341,0.710319986357435
GO:0014032,"neural crest cell development",13,"FOXC1, KLHL12, TAPT1, SOX11, CDH2, SNAI2, EDNRA, FAM172A, SOX8, NRG1, RDH10, EDN1, TCOF1",0.0322028979726514,0.307526735232442,0.65410232156015,0.39508,0.774143243243243
GO:0050765,"negative regulation of phagocytosis",7,"PIP4P2, TLR2, SIRPA, ATG5, ATG3, SNX3, CNN2",0.0666725809602731,0.307784591974878,0.65410232156015,0.3236,0.691482105263158
GO:0048854,"brain morphogenesis",12,"SHANK3, SPEF2, CTNNA1, MKKS, EMX1, CDH2, FANCC, GBA, CTNNA2, SHANK1, SHANK2, PAFAH1B1",0.0185076193252925,0.307825493200557,0.65410232156015,0.28624,0.638067935578331
GO:0030091,"protein repair",5,"PCMT1, MSRA, MSRB3, MSRB2, MSRB1",0.0377868568736589,0.308292353409034,0.654305672767964,0.32192,0.689343459915612
GO:0006107,"oxaloacetate metabolic process",6,"MDH1, GOT2, PCK2, MDH2, GOT1, NIT2",0.0510089383813697,0.308350949235477,0.654305672767964,0.30984,0.670982089552239
GO:0034333,"adherens junction assembly",5,"CTNNB1, VCL, ACTB, TBCD, PIP5K1C",0.0368647339365211,0.309109967557995,0.655459506416501,0.33658,0.708193181818182
GO:0061002,"negative regulation of dendritic spine morphogenesis",5,"DNM3, UBE3A, NLGN1, DTNBP1, NGEF",0.0387034184165436,0.310224376900358,0.657364807001802,0.33748,0.708193181818182
GO:0071260,"cellular response to mechanical stimulus",40,"PDE2A, FAS, SLC2A1, ITGA2, TNFRSF10B, PTGS2, RAC1, GOT1, CASP1, SLC9A1, CRADD, MAPK3, PTGER4, TLR4, ATP1A1, BMP6, CASP8AP2, MAP3K14, SCX, SLC38A2, BCL10, IL1B, AQP1, NPPA, KCNJ2, MAG, GADD45A, HDAC4, ARHGDIA, BAD, CNN2, TMEM150C, BAG3, MAP2K4, BNIP3, BAK1, RIPOR2, TLR3, NFKB1, GJA1",0.0267580645217659,0.310443691602944,0.657372072970072,0.34134,0.710319986357435
GO:0046329,"negative regulation of JNK cascade",8,"PINK1, FKTN, DUSP3, PAFAH1B1, SIRPA, DACT1, MECOM, PER1",0.0372687466070299,0.311755304784413,0.659690690110173,0.37302,0.749238720316623
GO:0061684,"chaperone-mediated autophagy",6,"HSPA8, ATG7, ATG5, BAG3, SYNPO2, STUB1",0.0869687821667433,0.312017045026025,0.659786043127948,0.30512,0.664153895639743
GO:0051898,"negative regulation of protein kinase B signaling",21,"HLA-G, PPP2R5B, RAPGEF1, PLEKHA1, CAVIN3, PTPRJ, PHLDA3, PHLPP2, PIK3CB, DLG1, CIB1, THEM4, BTN2A2, INPP5K, GPER1, DRD2, SIRT1, PPP2R5C, TRIB3, SH2B3, NOP53",0.0138410338388591,0.312754832533813,0.660887206846259,0.33868,0.709035051546392
GO:0010460,"positive regulation of heart rate",13,"RGS4, ATP2A2, NMU, KCNQ1, EDN1, ADM, EDN3, RYR2, ATP5PF, HRC, NPPA, SCN3B, ADM5",0.0401901559594802,0.313394457754254,0.661779558850002,0.38662,0.762966882696047
GO:0006541,"glutamine metabolic process",10,"GLUD1, GLS2, GFPT2, MECP2, CTPS2, GMPS, PHGDH, NIT2, PPAT, SIRT4",0.0161262336457434,0.314665623314355,0.664003342336944,0.35616,0.728755003357958
GO:0021591,"ventricular system development",10,"RAPGEF2, SEMA6D, SLC7A11, AK8, MBOAT7, NME5, TTC21B, KIF27, MECP2, CENPF",0.0183581526652321,0.316769726526761,0.667980482876723,0.34342,0.712227365554799
GO:0009887,"animal organ morphogenesis",61,"LY6H, EFNB2, HRAS, SYK, PAX6, DCN, SMARCC1, DGCR6, PDGFC, EVL, GAMT, FGF18, ELN, COMP, FOXF2, FOXF1, LAMA3, TLE2, LAMB1, LAMA1, TLE1, NTN4, LAMB3, LAMC3, FGF7, NTNG1, ATRNL1, ONECUT2, PTCH1, STX2, LAMA2, TMEM176B, FGFR2, LAMC1, DGCR2, AGRN, NTNG2, MEIS1, FGF9, TMEFF2, GREM2, ASXL3, PDGFA, PBX4, FGF17, NRP1, MEIS2, COL18A1, MEIS3P1, CCL2, ITGA2, MEIS3, ITGAX, VEGFC, GMNN, PHLDA2, BRAF, PBX3, FGD1, FGF2, FHL1",0.0203666039469776,0.31780168856922,0.669692831621643,0.36808,0.741547058823529
GO:0001657,"ureteric bud development",15,"RET, ROBO2, FOXC1, CRLF1, SMAD6, EPCAM, SMAD2, RARB, SPRY1, FGFR2, NPNT, SFRP1, SMAD3, SMAD1, ARG2",0.030169554852323,0.318595852679726,0.67090205491685,0.40266,0.778476
GO:0030513,"positive regulation of BMP signaling pathway",16,"ILK, SMAD2, ZNF423, FOXD1, ACVR2B, NUMA1, HES5, ACVRL1, FBXL15, ACVR2A, RNF165, SOX11, UBE2O, SULF1, MSX1, HES1",0.0209684780207825,0.320885478088155,0.675256586578046,0.3925,0.771072580645161
GO:0007283,"spermatogenesis",153,"CCNA1, WFDC2, SUN1, TRIM27, TCFL5, SPEF2, SIRT1, MERTK, ANKRD49, RACGAP1, HSPB11, BCL2L2, ING2, AZIN2, SOD1, SOX17, SSTR1, ADCYAP1R1, GLI1, BCL2L11, GAL3ST1, KIT, KDM2B, DHX36, ARID4A, UBE2B, ELL3, NME5, GJA1, CETN2, WDR33, NDRG3, WDR48, MEA1, YBX2, SPATA20, ACTR1A, INHBB, CCIN, CADM1, VCX, AR, RB1, PHC2, SSTR2, SOX8, BAD, CRTAP, TDRD6, PGM3, GGT5, MST1, DND1, PIWIL4, TDRD9, PLEKHA1, PUM1, CALR, ARNTL, BIRC3, CELF3, CCNYL1, ADAM28, LIMK2, KATNAL1, BCKDK, CREM, CNR1, METTL3, DNAJA1, LGR4, RAD51C, SIAH1, SOHLH1, CYP26B1, CCDC136, KDM5A, LRRC8A, TDRD1, IFT27, REC8, PCDH11Y, GAMT, PAFAH1B3, BRD2, CCNI, ACE, GGT1, PRDX4, BTG1, RGN, ARID4B, TYRO3, JAG2, CCNB1, ZCWPW1, TSPAN8, GPX4, ATP1A4, DAZAP1, SPAG4, PTTG1, TXNRD3, TAF4B, METTL14, ATP2B4, ACVR2A, SKIL, PAIP2, ZNF541, TDRKH, CLOCK, YTHDC1, CFAP97, GGNBP2, YBX3, LRRK2, MYBL1, GGN, DNMT3A, HERC4, GALNT3, IFT20, SLC4A2, SYNE1, C9orf24, ZNF35, BCAP31, ERCC1, OAZ3, TDRD7, WIPF3, STRBP, AP3B1, DLEC1, INPP5B, RGS2, SPOCD1, E2F1, SPATC1L, USP9Y, ATRX, EIF5A2, UBR2, RPL39L, CDYL, MICAL2, SPA17, NDC1, NR0B1, DPCD, SPATA6, CTSV",0.00674477268748561,0.321333942055866,0.675733324281845,0.35296,0.724233962264151
GO:0014002,"astrocyte development",10,"LAMC3, PLP1, EIF2B5, MT3, DRD1, CDK6, GFAP, TSPAN2, POU3F2, TLR4",0.041233985697599,0.322519790033025,0.677758979054907,0.33276,0.704137734537874
GO:0045664,"regulation of neuron differentiation",14,"BCL11B, ZFHX3, LTK, NREP, ZFHX2, DPYSL2, ID2, NLGN1, YWHAG, BDNF, YWHAH, ROCK1, ALK, S1PR5",0.0318805683537064,0.323471240232406,0.679289604488054,0.30174,0.660968583752696
GO:1900015,"regulation of cytokine production involved in inflammatory response",6,"TREM2, PER1, NOS2, BAP1, ALOX5, PLD3",0.0509838062713404,0.324931893858473,0.681834730108162,0.33666,0.708193181818182
GO:0007155,"cell adhesion",257,"CTNNA1, COL19A1, HCK, CGREF1, SPECC1L, NPNT, NLGN1, PLXNC1, LAMA3, NCAN, RELN, PCDH11X, PRKCA, SUSD5, FREM3, MAG, AATF, LAMA1, LAMA4, TGFBI, MCAM, LAMC1, TNFRSF12A, ICAM2, EMB, CNTN2, APBA1, ADAM22, SIGLEC11, ADAM23, TYRO3, CD44, RND3, AMIGO2, DPT, CD99L2, THBS4, PCDHAC2, NRP2, FAP, CLDN4, CX3CR1, CYP1B1, PCDHB11, LAMA2, SLC7A11, PPFIBP1, CD33, HAPLN2, FES, SSX2IP, PCDH18, COL12A1, VCL, MXRA8, PSTPIP1, EPHA3, ROBO2, EFNB2, PCDH8, PBXIP1, ALCAM, ITGB4, PCDHA11, AJAP1, ISLR, CD151, PCDHGA7, NPHS1, PTPRT, EFNB1, CTNNAL1, PCDHB18P, ATP1B1, MYH10, PCDH11Y, OLFM4, HES1, LAMB1, COL5A1, FIBCD1, SIRPA, RIPOR2, MOG, ANOS1, MTSS1, STAB1, ADGRE5, CADM4, ITGA7, KIRREL2, FOLR2, LY6D, PDZD2, ACAN, PCDH17, ITGA11, NLGN4X, SEMA5A, CDHR1, PCDHB12, AZGP1, SCN1B, CCL2, CTNNA2, CDH8, CDH2, PCDH19, ROBO1, THEMIS2, OMG, LMLN, PARD3, NTM, NECTIN1, LSAMP, DSCAM, PKN2, NRCAM, COMP, DGCR6, CIB1, FERMT2, RAC1, CDH4, PCDHGA3, CXCL12, NCAM1, ITGA2, PNN, ADGRG1, FEZ1, SELPLG, CTNNA3, MADCAM1, PCDH1, CNTN3, BCAN, TPBG, PTPRF, CCR1, CTNND2, JCAD, ITGA2B, PXN, NCAM2, COL7A1, PCDH15, NEXN, MYBPC1, CNTNAP5, NUAK1, PCDHB8, ROM1, PCDHGA12, PCDHGB2, LOXL2, CDH11, COL16A1, GPNMB, PCDHB2, MPZL3, PCDHB14, FN1, PARVA, CNTNAP3B, CASK, ITGB8, ACHE, VWF, NEDD9, ITGAV, CLDN5, PARD3B, ACTN2, CNTNAP3, PCDH7, ADAMTSL1, ITGB3BP, PCDHB16, SORBS3, COL18A1, PCDH12, EDIL3, PCDHGB4, FBLN7, SPON1, EMP2, MYBPC2, SPON2, CNTN1, BCAR1, PCDHB10, CHL1, ADAM9, NID2, CTNNB1, DDR1, EMILIN2, COL6A1, CNTNAP2, PCDH10, CD24, THY1, MAEA, HES5, SPP1, FAT1, CLDN10, MFAP4, EGFL7, LRRN2, OBSCN, AGGF1, THBS3, ITGAX, CNTN6, ITGB2, DSCAML1, HAPLN4, MAGI1, ITGB7, AFDN, NECTIN3, PARVB, ACKR3, CDH6, ICAM5, TNC, PRPH2, PTPRK, ITGA8, KITLG, PCDHB9, PCDH20, FLOT2, ICAM3, CNTN5, IGFALS, ITGA1, JUP, S1PR1, DGCR2, CNTN4, CDH3, MFGE8, EPHA4, ITGB5, RGMB, FLRT1, ITGAM, TLN2, SEMA4D, ITGB1, ATP2A2, FERMT1, FOLR1",0.0183846234787537,0.325153085395864,0.681834730108162,0.38062,0.755533181225554
GO:0002091,"negative regulation of receptor internalization",9,"LRRTM1, ANKRD13A, WDR54, MTMR2, LRPAP1, SDCBP, ANXA2, DLG4, LRRTM2",0.0153078619142465,0.325354963168197,0.681834730108162,0.2897,0.643425601750547
GO:0045047,"protein targeting to ER",10,"SRP14, SRPRA, ZFAND2A, SPCS3, SPCS2, MAN1A1, EDEM1, HERPUD1, SEC61G, SPCS1",0.0456222036238699,0.325867401486093,0.682438952905882,0.34082,0.710319986357435
GO:0010389,"regulation of G2/M transition of mitotic cell cycle",37,"PCNT, KCNH5, NDE1, HAUS7, YWHAG, CENPJ, CTC1, TUBA4A, CEP131, DYNC1I2, MAPRE1, CDKN2A, CEP78, CEP135, RNASEH2B, CCNB3, PAFAH1B1, HAUS3, TUBA1A, CEP192, CNTRL, CEP63, DYNLL1, HAUS8, DCTN2, CENPF, SFI1, PKIA, ACTR1A, CEP152, CEP72, HAUS4, ODF2, CETN2, CEP57, TUBB, TUBB4B",0.0172268551273043,0.326781058233523,0.683882008468095,0.38198,0.7572455078125
GO:0045109,"intermediate filament organization",10,"KRT19, KRT14, NEFL, DSP, TCHH, KRT17, BFSP1, KRT31, GFAP, KLHL24",0.0349197391536619,0.327192175168305,0.684272097106792,0.3029,0.662118090452261
GO:0097191,"extrinsic apoptotic signaling pathway",19,"KRT18, BAD, IL33, INHBA, KRT8, WWOX, FAS, CIB1, TNF, NDUFA13, TRADD, SIVA1, G0S2, JAK2, TLR3, SMAD3, IFI27, IL6R, TNFSF12",0.0146888770662971,0.328514415730305,0.686565817363609,0.32776,0.697434800838574
GO:0010634,"positive regulation of epithelial cell migration",12,"RAB11A, CTSH, RREB1, EPB41L5, TAC1, JUN, CAPN7, RTN4, PLCG2, PFN1, ENPP2, ITGA2",0.0213439597547819,0.328918439972932,0.68693871722742,0.36274,0.735381691078562
GO:0015867,"ATP transport",7,"ABCC6, SLC25A25, SLC25A23, SLC25A17, SLC25A41, CALHM1, GJA1",0.0198446911362362,0.329245841237846,0.687151190246224,0.3187,0.68437341325811
GO:0007059,"chromosome segregation",32,"PMF1, RGS14, DDX3X, NR3C1, ARL8A, BRCA1, CENPW, TOP1, CENPF, RPS3, USP9X, ERCC2, CDT1, ARL8B, TLK2, SLC25A5, MIS18A, CENPN, NUMA1, TLK1, NDE1, NEK6, MMS19, SRPK1, TOP3B, PHF13, NTMT1, SKA2, UBE2I, CENPC, NEK11, NDEL1",0.0173188522941431,0.330425159925742,0.688209654822437,0.32406,0.691494533987386
GO:0032026,"response to magnesium ion",5,"KCNC2, ENTPD6, SNCA, CCND1, BMP6",0.0545097800183743,0.3305608331695,0.688209654822437,0.37444,0.75080599078341
GO:0031116,"positive regulation of microtubule polymerization",14,"RPS3, CDKN1B, MAPRE1, SLAIN2, FES, NUMA1, CLIP1, SLAIN1, ARL3, MET, NAV3, MAP1B, RAC1, PAK1",0.0196876757703647,0.330648876043269,0.688209654822437,0.37758,0.754226146788991
GO:0035335,"peptidyl-tyrosine dephosphorylation",52,"PTPRC, EYA2, PTPRM, DUSP7, PGP, PTPN4, DUSP3, ACP1, DUSP18, DUSP22, EYA4, DUSP4, PALD1, PTPRO, PTPN2, DUSP23, DUSP28, PTPDC1, SSH3, PTPRR, PTPN14, PTPRA, PTPRD, PTPRF, CDC14A, DUSP1, MTMR3, PTPRZ1, DUSP8, TIMM50, PTPRS, DUSP6, HACD2, PTP4A1, RNGTT, PTP4A2, PTPN5, TPTE, PTPRK, CDC14B, DUSP2, PTPRJ, PTPRE, MTMR2, EPM2A, PTPN12, PTPRT, MTMR4, EYA3, PTPN3, PTPRG, DUSP14",0.00552463081914683,0.330824768142284,0.688209654822437,0.34008,0.709762577107608
GO:0003382,"epithelial cell morphogenesis",7,"BCL11B, RILPL1, SIPA1L3, FAT1, AR, DACT2, RILPL2",0.0337515299395429,0.330883065569802,0.688209654822437,0.35556,0.728137928715535
GO:0060402,"calcium ion transport into cytosol",9,"CACNA1C, ADRA1A, JPH4, JPH3, RYR2, CACNB3, ITPR3, SLC8A1, CACNA2D1",0.0149704970897354,0.333504813692469,0.693189186138954,0.27678,0.624755448480356
GO:0000165,"MAPK cascade",154,"MAP2K5, TNIK, PSMB2, MINK1, CALM1, RAPGEF2, MEF2A, MAP3K9, SPTBN5, ERBB2, FGF2, PSME1, RASGRP3, FLT3, RASGRP1, BTC, IL3RA, PSMB5, FGFR1, RALGDS, NCAM1, MBP, RASAL1, PPM1L, YWHAB, RGL2, PSME2, KITLG, NEFL, MAP3K21, FGF13, DUSP7, MAP3K14, PIK3R2, ANGPT1, MET, GFRA1, ABHD17B, FNTA, PSMA7, PAK3, PPP1CB, PSMD1, ABHD17A, SMAD1, PSMD9, DLG2, PSMC3, GRIN2B, MAPKAPK2, LYPLA1, MAPK3, MAP3K5, PSMB8, CCL2, LRRC7, SPTB, NRG2, PSMB1, NLK, MAP2K3, CUL3, PIK3R1, PSMB6, NRG4, FGFR2, MAP2K1, NRG1, LRRK2, PSMC1, PTPRA, IL17RD, FGF18, PDGFRA, RGL1, CAMK2A, PSMD8, PPP1CC, PSMB10, PSME3, CCR5, SOS1, CAMKK2, DLG4, PSMA5, ZFP36L1, GFRA2, SHC1, MAP2K4, MAP3K6, SHC3, RASGRF1, TNF, SPRED1, MAP2K7, PDGFB, RIPK2, ACTN2, PSMD4, MEF2C, FGF7, FGFR3, PDGFA, SHANK3, RET, SHC2, RASAL3, KIT, PRKG2, PTPN3, RANBP9, RASAL2, KRAS, CSF2RA, DLG1, PIK3CB, IL1B, PSMB7, MAP2K6, MAPK6, JAK1, FGF9, MAPK1, PSMD2, HGF, RGL3, LAT, DUSP6, JAK2, SCG2, ABHD17C, PSMD6, MAP2K2, IRS1, RASGEF1A, SPTBN4, LAMTOR2, PSMD7, MRAS, MAPK7, PEA15, BRAF, RASGRF2, PSMC2, HRAS, TEK, MAP3K3, PIK3CA, PSMD12, FGF17, SEM1, RASA3, PSMA6, MYC",0.0112173751824798,0.335342029522564,0.695272673752819,0.36628,0.740586055776892
GO:0035025,"positive regulation of Rho protein signal transduction",12,"NET1, AKAP13, GPR4, PRAG1, RAC1, RTN4R, LPAR6, GPR20, MCF2L, ADGRG1, ROBO1, ARRB1",0.0269999462579327,0.335407600933294,0.695272673752819,0.30514,0.664153895639743
GO:0019082,"viral protein processing",21,"GALNT1, MGAT5, UBE2I, ST3GAL1, SPCS1, PARP16, ST3GAL2, MAN2A1, ST3GAL4, RPN2, MGAT1, MGAT4C, MGAT4B, TUSC3, CANX, DAD1, MGAT4A, PRMT1, SPCS3, ST3GAL3, ST6GAL1",0.0294569753616836,0.335414791939313,0.695272673752819,0.34694,0.716835142469471
GO:0051574,"positive regulation of histone H3-K9 methylation",5,"RIF1, SIRT1, JARID2, BRCA1, MYB",0.0287570687903947,0.335507221021953,0.695272673752819,0.39802,0.775306841432225
GO:0032933,"SREBP signaling pathway",5,"SREBF1, EIF2A, ARHGEF10L, ERLIN1, INSIG2",0.0233818194205454,0.335823243886729,0.695272673752819,0.45012,0.82941752265861
